addr_string,matched_addr,lat,long
"2799 W GRAND BLVD, DETROIT, MI, 48202","HENRY FORD HOSPITAL, 2799, WEST GRAND BOULEVARD, LASALLE GARDENS, DETROIT, WAYNE COUNTY, MICHIGAN, 48202, USA",42.36764305,-83.08540269
"908 W 4TH N ST, MORRISTOWN, TN, 37814","MORRISTOWN-HAMBLEN HEALTHCARE SYSTEM, 908, WEST 4TH NORTH STREET, MORRISTOWN, HAMBLEN COUNTY, TENNESSEE, 37814, USA",36.2129539,-83.30497067
"1850 OLD KNOXVILLE RD, TAZEWELL, TN, 37879","CLAIBORNE MEDICAL CENTER, 1850, OLD KNOXVILLE ROAD, TAZEWELL, CLAIBORNE COUNTY, TENNESSEE, 37879, USA",36.45256175,-83.5718569
"1901 CLINCH AVE, KNOXVILLE, TN, 37916","FORT SANDERS REGIONAL MEDICAL CENTER, 1901, CLINCH AVENUE, 4TH AND GILL, FORT SANDERS, KNOXVILLE, KNOX COUNTY, TENNESSEE, 37916, USA",35.95727965,-83.93718487
"3 MEDICAL PLAZA DR, ROSEVILLE, CA, 95661","SUTTER URGENT CARE-ROSEVILLE, 3, MEDICAL PLAZA DRIVE, ROSEVILLE, PLACER COUNTY, CALIFORNIA, 95661, USA",38.764993700000005,-121.2461959
"234 GOODMAN ST, CINCINNATI, OH, 45219","UCMC, 234, GOODMAN STREET, PILL HILL, CORRYVILLE, CINCINNATI, HAMILTON COUNTY, OHIO, 45219, USA",39.1379036,-84.50339364
"1203 E ALTON GLOOR BLVD, BROWNSVILLE, TX, 78526","1203, EAST ALTON GLOOR BOULEVARD, BROWNSVILLE, CAMERON COUNTY, TEXAS, 78526, USA",25.98030612,-97.49234191
"1225 W LAKE ST, MELROSE PARK, IL, 60160","WESTLAKE HOSPITAL, 1225, WEST LAKE STREET, MELROSE PARK, COOK COUNTY, ILLINOIS, 60160, USA",41.89270525,-87.84868241
"3249 OAK PARK AVE, BERWYN, IL, 60402","3249, OAK PARK AVENUE, BERWYN, COOK COUNTY, ILLINOIS, 60402, USA",41.83253489,-87.79291851
"4480 UTICA RIDGE RD, BETTENDORF, IA, 52722","4480, UTICA RIDGE ROAD, BETTENDORF, SCOTT COUNTY, IOWA, 52722, USA",41.56589164,-90.51742657
"2215 PARK AVE, MINNEAPOLIS, MN, 55404","PARK AVENUE, MARCY-HOLMES, PHILLIPS, MINNEAPOLIS, HENNEPIN COUNTY, MINNESOTA, 55415, USA",44.9758341,-93.26019079999999
"800 E 28TH ST, MINNEAPOLIS, MN, 55407","ABBOTT NORTHWESTERN HOSPITAL, 800, EAST 28TH STREET, EAST PHILLIPS, MINNEAPOLIS, HENNEPIN COUNTY, MINNESOTA, 55407, USA",44.9540508,-93.26133433
"12505 LEBANON RD, FRISCO, TX, 75035","BAYLOR SCOTT & WHITE MEDICAL CENTER – CENTENNIAL, 12505, LEBANON ROAD, FRISCO, COLLIN COUNTY, TEXAS, 75035, USA",33.114376899999996,-96.77048231
"4500 MEDICAL CTR DR, MCKINNEY, TX, 75069","MEDICAL CITY MCKINNEY, 4500, MEDICAL CENTER DRIVE, MCKINNEY, COLLIN COUNTY, TEXAS, 75609, USA",33.16003775,-96.63738999
"4700 ALLIANCE BLVD, PLANO, TX, 75093","BAYLOR SCOTT & WHITE MEDICAL CENTER - PLANO, 4700, ALLIANCE BOULEVARD, PLANO, COLLIN COUNTY, TEXAS, 75093, USA",33.014144800000004,-96.79111072
"1100 ALLIED DR, PLANO, TX, 75093","THE HEART HOSPITAL BAYLOR PLANO, 1100, ALLIED DRIVE, PLANO, COLLIN COUNTY, TEXAS, 75093, USA",33.0147813,-96.7899585
"3301 MATLOCK RD, ARLINGTON, TX, 76015","MEDICAL CITY ARLINGTON, 3301, MATLOCK ROAD, ARLINGTON, TARRANT COUNTY, TEXAS, 76015, USA",32.69218405,-97.11294287
"540 BORDENTOWN AVE, SOUTH AMBOY, NJ, 08879","CORE HEALTH SERVICES, 540, BORDENTOWN AVENUE, THOMAS J DOHANY HOMES, SOUTH AMBOY, MIDDLESEX COUNTY, NEW JERSEY, 08879, USA",40.4754626,-74.2864468
"21 RIVERSIDE DR, MIDDLETOWN, NY, 10941","21, RIVERSIDE DRIVE, ARKVILLE, TOWN OF MIDDLETOWN, DELAWARE COUNTY, NEW YORK, 12406, USA",42.14620699,-74.62258552
"423 CLAY PITTS RD, EAST NORTHPORT, NY, 11731","423, CLAY PITTS ROAD, EAST NORTHPORT, SUFFOLK COUNTY, NEW YORK, 11731, USA",40.86838373,-73.30019736
"1529 N OCEAN AVE, MEDFORD, NY, 11763","N OCEAN AVE, MEDFORD, SUFFOLK COUNTY, NEW YORK, 11742, USA",40.8223078,-73.01991070000001
"219 BLOOMING GROVE TPKE, NEW WINDSOR, NY, 12553","219, BLOOMING GROVE TURNPIKE, NEW WINDSOR, TOWN OF NEW WINDSOR, ORANGE COUNTY, NEW YORK, 12553, USA",41.46543575,-74.03032244
"11100 EUCLID AVE, CLEVELAND, OH, 44106","UNIVERSITY HOSPITALS CLEVELAND MEDICAL CENTER, 11100, EUCLID AVENUE, MAGNOLIA-WADE PARK HISTORIC DISTRICT, UNIVERSITY CIRCLE, CLEVELAND, CUYAHOGA COUNTY, OHIO, 44106, USA",41.505776000000004,-81.60606907
"4545 CRAIN HWY, WHITE PLAINS, MD, 20695","CHARLES COUNTY HEALTH DEPARTMENT, 4545, CRAIN HIGHWAY, CARRINGTON, SAINT CHARLES, ST. CHARLES, CHARLES COUNTY, MARYLAND, 20695, USA",38.5893523,-76.94564396
"50 MEDICAL PARK DR E, BIRMINGHAM, AL, 35235","ST. VINCENT'S EAST, 50, MEDICAL PARK DRIVE EAST, HUFFMAN, BIRMINGHAM, JEFFERSON COUNTY, ALABAMA, 35235, USA",33.595315299999996,-86.66763067
"400 PARNASSUS AVE, SAN FRANCISCO, CA, 94143","CHASE ATM, 400, PARNASSUS AVENUE, COLE VALLEY, SF, CALIFORNIA, 94117, USA",37.7638858,-122.4574953
"2330 POST ST, SAN FRANCISCO, CA, 94143","2330, POST STREET, WESTERN ADDITION, SF, CALIFORNIA, 94115, USA",37.78428641,-122.4405938
"2380 SUTTER ST, SAN FRANCISCO, CA, 94143","2380, SUTTER STREET, WESTERN ADDITION, SF, CALIFORNIA, 94115, USA",37.78540220000001,-122.4395597
"350 PARNASSUS AVE, SAN FRANCISCO, CA, 94143","MEDICAL OFFICES, 350, PARNASSUS AVENUE, COLE VALLEY, SF, CALIFORNIA, 94117, USA",37.7642379,-122.4562361
"505 PARNASSUS AVE, SAN FRANCISCO, CA, 94143","UNIVERSITY OF CALIFORNIA MEDICAL CENTER, 505, PARNASSUS AVENUE, COLE VALLEY, SF, CALIFORNIA, 94143, USA",37.76307,-122.4574027
"1600 DIVISADERO ST, SAN FRANCISCO, CA, 94143","DIVISADERO STREET, WESTERN ADDITION, SF, CALIFORNIA, 94143, USA",37.771281200000004,-122.43701750000001
"4111 N ILLINOIS ST, SWANSEA, IL, 62226","4111, NORTH ILLINOIS STREET, SWANSEA, SAINT CLAIR COUNTY, ILLINOIS, 62232, USA",38.5657455,-89.984886
"12 PROFESSIONAL PARK DR, MARYVILLE, IL, 62062","12, PROFESSIONAL PARK DRIVE, MARYVILLE, MADISON COUNTY, ILLINOIS, 62062, USA",38.73711467,-89.95522292
"14300 ORCHARD PKWY, WESTMINSTER, CO, 80023","SAINT ANTHONY NORTH HEALTH CAMPUS, 14300, ORCHARD PARKWAY, WESTMINSTER, ADAMS COUNTY, COLORADO, 80023, USA",39.9554252,-104.9913967
"1701 VETERANS DR, FLORENCE, AL, 35630","VETERANS DRIVE, FLORENCE, LAUDERDALE COUNTY, ALABAMA, 35630, USA",34.8078722,-87.64035820000001
"201 AVALON AVE, MUSCLE SHOALS, AL, 35661","201, AVALON AVENUE, TUSCUMBIA, COLBERT COUNTY, ALABAMA, 35661, USA",34.74485587,-87.67533521
"200 E PENNSYLVANIA AVE, PEORIA, IL, 61603","200, EAST PENNSYLVANIA AVENUE, PEORIA, PEORIA COUNTY, ILLINOIS, 61603, USA",40.705073999999996,-89.592276
"1775 THOMPSON RD, COOS BAY, OR, 97420","BAY AREA HOSPITAL, 1775, THOMPSON ROAD, COOS BAY, COOS COUNTY, OREGON, 97420, USA",43.3836747,-124.23245
"440 S RIVERSIDE AVE, CROTON ON HUDSON, NY, 10520","440, S RIVERSIDE AVENUE, CROTON-ON-HUDSON, CORTLAND, WESTCHESTER COUNTY, NEW YORK, 10520, USA",41.19379708,-73.8791662
"701 N BROADWAY, SLEEPY HOLLOW, NY, 10591","PHELPS HOSPITAL, 701, NORTH BROADWAY, SLEEPY HOLLOW, TOWN OF MOUNT PLEASANT, WESTCHESTER COUNTY, NEW YORK, 10591, USA",41.1095281,-73.86400339
"3181 SW SAM JACKSON PARK RD, PORTLAND, OR, 97239","RICHARD T. JONES HALL, 3181, SOUTHWEST SAM JACKSON PARK ROAD, MARQUAM HILL, HOMESTEAD, PORTLAND, MULTNOMAH COUNTY, OREGON, 97239, USA",45.50056345,-122.688027
"2410 HIGH SCHOOL AVE, CONCORD, CA, 94520","HIGH SCHOOL STREET, CONCORD, CONTRA COSTA COUNTY, CALIFORNIA, 94520, USA",37.9856597,-122.0328074
"300 HOSPITAL DR, VALLEJO, CA, 94589","SUTTER SOLANO MEDICAL CENTER, 300, HOSPITAL DRIVE, VALLEJO, SOLANO COUNTY, CALIFORNIA, 94589, USA",38.13114005,-122.23841170000001
"350 HAWTHORNE AVE, OAKLAND, CA, 94609","SAMUEL MERRITT UNIVERSITY, 350, HAWTHORNE AVENUE, PILL HILL, OAKLAND, ALAMEDA COUNTY, CALIFORNIA, 94609, USA",37.8205823,-122.2664037
"1924 ALCOA HWY, KNOXVILLE, TN, 37920","UNIVERSITY OF TENNESSEE MEDICAL CENTER, 1924, ALCOA HIGHWAY, FORT SANDERS, KNOXVILLE, KNOX COUNTY, TENNESSEE, 37920, USA",35.93990805,-83.94282107
"1100 VETERANS BLVD, REDWOOD CITY, CA, 94063","1100, VETERANS BOULEVARD, REDWOOD CITY, SAN MATEO COUNTY, CALIFORNIA, 94063, USA",37.489670000000004,-122.224557
"1150 VETERANS BLVD, REDWOOD CITY, CA, 94063","1150, VETERANS BOULEVARD, REDWOOD CITY, SAN MATEO COUNTY, CALIFORNIA, 94063, USA",37.4893235,-122.22347690000001
"1190 VETERANS BLVD, REDWOOD CITY, CA, 94063","KASIER PERMANENTE CYPRESS BUILDING, 1190, VETERANS BOULEVARD, REDWOOD CITY, SAN MATEO COUNTY, CALIFORNIA, 94063, USA",37.48915325,-122.222613
"158 ORCHARD ST, ROCHESTER, NY, 14611","158, ORCHARD STREET, ROCHESTER, MONROE COUNTY, NEW YORK, 14611, USA",43.15896039,-77.63440455
"5200 HARRY HINES BLVD, DALLAS, TX, 75235","PARKLAND MEMORIAL HOSPITAL, 5200, HARRY HINES BOULEVARD, DALLAS, DALLAS COUNTY, TEXAS, 75235, USA",32.8131807,-96.83538145
"2001 INWOOD RD, DALLAS, TX, 75390","2001, INWOOD ROAD, DALLAS, DALLAS COUNTY, TEXAS, 75209, USA",32.81504101,-96.84461377
"5323 HARRY HINES BLVD, DALLAS, TX, 75390","UNIVERSITY OF TEXAS SOUTHWESTERN MEDICAL CENTER, 5323, HARRY HINES BOULEVARD, DALLAS, DALLAS COUNTY, TEXAS, 75390, USA",32.81152825,-96.84149851
"4433 LEISURE TIME DR, DIAMONDHEAD, MS, 39525","4433, LEISURE TIME DRIVE, DIAMONDHEAD, HANCOCK COUNTY, MISSISSIPPI, 39525, USA",30.37606225,-89.3825149
"211 SAINT FRANCIS DR, CAPE GIRARDEAU, MO, 63703","SAINT FRANCIS MEDICAL CENTER, 211, SAINT FRANCIS DRIVE, CAPE GIRARDEAU, CAPE GIRARDEAU COUNTY, MISSOURI, 63703, USA",37.3042629,-89.57133675
"2005 ASBURY RD, DUBUQUE, IA, 52001","2005, ASBURY ROAD, WEST END DISTRICT, DUBUQUE, DUBUQUE COUNTY, IOWA, 52001, USA",42.50519953,-90.70212761
"1221 S GEAR AVE, WEST BURLINGTON, IA, 52655","GREAT RIVER MEDICAL CENTER, 1221, SOUTH GEAR AVENUE, WEST BURLINGTON, DES MOINES COUNTY, IOWA, 52655, USA",40.80642445,-91.17518375
"1223 S GEAR AVE, WEST BURLINGTON, IA, 52655","BURLINGTON PEDIATRICS ASSOCIATION, 1223, SOUTH GEAR AVENUE, WEST BURLINGTON, DES MOINES COUNTY, IOWA, 52655, USA",40.8094835,-91.1724171
"504 MEDICAL CTR BLVD, CONROE, TX, 77304","CONROE REGIONAL MEDICAL CENTER, 504, MEDICAL CENTER BOULEVARD, CONROE, MONTGOMERY COUNTY, TEXAS, 77304, USA",30.284319099999998,-95.46818561
"900 CENTENNIAL BLVD K, VOORHEES, NJ, 08043","CENTENNIAL BOULEVARD, SHEPPARD OFFICE PARK, VOORHEES, CAMDEN COUNTY, NEW JERSEY, 08043, USA",39.858799700000006,-74.9484109
"900 CENTENNIAL BLVD M, VOORHEES, NJ, 08043","900, CENTENNIAL BOULEVARD, VOORHEES, CAMDEN COUNTY, NEW JERSEY, 08043-4637, USA",39.8660427,-74.9423872
"218 SUNSET RD C, WILLINGBORO, NJ, 08046","LOURDES MEDICAL CENTER OF BURLINGTON COUNTY, 218, SUNSET ROAD, CHÂTEAU APARTMENTS, WILLINGBORO TOWNSHIP, BURLINGTON COUNTY, NEW JERSEY, 08046, USA",40.0461623,-74.87995565
"3 COOPER PLZ, CAMDEN, NJ, 08103","3, COOPER PLAZA, LANNING SQUARE, CAMDEN, CAMDEN COUNTY, NEW JERSEY, 08103, USA",39.94092112,-75.11572528
"5001 HARDY ST, HATTIESBURG, MS, 39402","MERIT HEALTH WESLEY, 5001, HARDY STREET, HATTIESBURG, LAMAR COUNTY, MISSISSIPPI, 39402, USA",31.32619465,-89.36725202
"5003 HARDY ST, HATTIESBURG, MS, 39402","5003, HARDY STREET, HATTIESBURG, LAMAR COUNTY, MISSISSIPPI, 39402, USA",31.32618665,-89.36767784
"5002 UNDERWOOD AVE, OMAHA, NE, 68132","UNDERWOOD AVENUE, OMAHA, DOUGLAS COUNTY, NEBRASKA, 68132, USA",41.265062,-96.01317900000001
"1221 MADISON ST, SEATTLE, WA, 98104","ARNOLD PAVILION, 1221, MADISON STREET, CENTRAL BUSINESS DISTRICT, FIRST HILL, SEATTLE, KING COUNTY, WASHINGTON, 98104, USA",47.60980395,-122.32288899999999
"341 CONKLIN ST, FARMINGDALE, NY, 11735","341, CONKLIN STREET, FARMINGDALE, NASSAU COUNTY, NEW YORK, 11735, USA",40.732839,-73.446928
"14139 POTOMAC MILLS RD, WOODBRIDGE, VA, 22192","BETHEL, PRINCE WILLIAM COUNTY, VIRGINIA, 22192, USA",38.651808,-77.2960347
"3952 PARKVIEW DR, CHEYENNE, WY, 82001","CHEYENNE WOMEN'S CLINIC, 3952, PARKVIEW DRIVE, CHEYENNE, LARAMIE COUNTY, WYOMING, 82001, USA",41.15755885,-104.76173809999999
"4902 QUEENS BLVD, WOODSIDE, NY, 11377","QUEENS BOULEVARD, WOODSIDE, QUEENS COUNTY, NYC, NEW YORK, 11377, USA",40.7408024,-73.8992192
"900 23RD ST NW, WASHINGTON, DC, 20037","GEORGE WASHINGTON UNIVERSITY HOSPITAL, 900, 23RD STREET NORTHWEST, GEORGE WASHINGTON UNIVERSITY, WASHINGTON, D.C., 20037, USA",38.901410600000006,-77.05060019
"3751 KATELLA AVE, LOS ALAMITOS, CA, 90720","KATELLA AVENUE, KOREATOWN, GARDEN GROVE, ORANGE COUNTY, CALIFORNIA, CA 90680, USA",33.8030588,-117.98430090000001
"8700 BEVERLY BLVD, WEST HOLLYWOOD, CA, 90048","CEDARS-SINAI MEDICAL CENTER, 8700, BEVERLY BOULEVARD, WEST HOLLYWOOD, LOS ANGELES COUNTY, CALIFORNIA, 90048, USA",34.0751604,-118.3810936
"660 N WESTMORELAND RD, LAKE FOREST, IL, 60045","NORTHWESTERN MEDICINE LAKE FOREST HOSPITAL, 660, NORTH WESTMORELAND ROAD, LAKE FOREST, LAKE COUNTY, ILLINOIS, 60045, USA",42.2544975,-87.86541998
"1515 HOLCOMBE BLVD, HOUSTON, TX, 77030","UNIVERSITY OF TEXAS MD ANDERSON CANCER CENTER, 1515, HOLCOMBE BOULEVARD, HOUSTON, HARRIS COUNTY, TEXAS, 77030, USA",29.70766895,-95.39762257
"550 SUMMIT AVE, TROY, OH, 45373","550, SUMMIT AVENUE, HOBART CIRCLE HISTORIC DISTRICT, TROY, MIAMI COUNTY, OHIO, 45373, USA",40.03554971,-84.21871614
"15717 15 MILE RD, CLINTON TOWNSHIP, MI, 48035","15717, 15 MILE ROAD, FRASER, MACOMB COUNTY, MICHIGAN, 48035, USA",42.55333061,-82.96353038
"80600 VAN DYKE RD, BRUCE TWP, MI, 48065","80600, VAN DYKE ROAD, BRUCE TOWNSHIP, MACOMB COUNTY, MICHIGAN, 48065, USA",42.88641175,-83.04010446
"80650 VAN DYKE RD, BRUCE TWP, MI, 48065","HENRY FORD MACOMB HEALTH CENTER - BRUCE TOWNSHIP, 80650, VAN DYKE ROAD, BRUCE TOWNSHIP, MACOMB COUNTY, MICHIGAN, 48065, USA",42.887032899999994,-83.0392917
"50505 SCHOENHERR RD, SHELBY TOWNSHIP, MI, 48315","50505, SCHOENHERR ROAD, SHELBY CHARTER TOWNSHIP, MACOMB COUNTY, MICHIGAN, 48315, USA",42.66661983,-82.99465502
"115 MALL DR, HANFORD, CA, 93230","ADVENTIST MEDICAL CENTER - HANFORD, 115, MALL DRIVE, KINGS COUNTY GOVERNMENT CENTER, HANFORD, KINGS COUNTY, CALIFORNIA, 93230, USA",36.323861799999996,-119.66695459999998
"1141 ROSE AVE, SELMA, CA, 93662","ADVENTIST HEALTH SELMA, 1141, ROSE AVENUE, SELMA, FRESNO COUNTY, CALIFORNIA, 93662, USA",36.567593,-119.59840790000001
"900 HYDE ST, SAN FRANCISCO, CA, 94109","SAINT FRANCIS MEMORIAL HOSPITAL, 900, HYDE STREET, NOB HILL, SF, CALIFORNIA, 94109, USA",37.78963455,-122.4165341
"2222 WELBORN ST, DALLAS, TX, 75219","TEXAS SCOTTISH RITE HOSPITAL FOR CHILDREN, 2222, WELBORN STREET, OAK LAWN, DALLAS, DALLAS COUNTY, TEXAS, 75219, USA",32.8021218,-96.81493751
"1935 MEDICAL DISTRICT DR, DALLAS, TX, 75235","CHILDRENS MEDICAL CENTER OF DALLAS, 1935, MEDICAL DISTRICT DRIVE, DALLAS, DALLAS COUNTY, TEXAS, 75235, USA",32.80947825,-96.83754658
"2248 31ST ST, ASTORIA, NY, 11105","31ST STREET, ASTORIA, QUEENS COUNTY, NYC, NEW YORK, 11101, USA",40.7707745,-73.917346
"996 MIDDLE COUNTRY RD, SELDEN, NY, 11784","996, MIDDLE COUNTRY ROAD, SELDEN, SUFFOLK COUNTY, NEW YORK, 11784, USA",40.86382768,-73.0473746
"3333 BURNET AVE, CINCINNATI, OH, 45229","CINCINNATI CHILDREN’S HOSPITAL MEDICAL CENTER, 3333, BURNET AVENUE, PILL HILL, CORRYVILLE, CINCINNATI, HAMILTON COUNTY, OHIO, 45229, USA",39.14080035,-84.50229358
"2100 ERWIN RD, DURHAM, NC, 27705","PICKENS BUILDING, 2100, ERWIN ROAD, CREST STREET, DURHAM, DURHAM COUNTY, NORTH CAROLINA, 27705, USA",36.0081084,-78.933207
"932 MORREENE RD, DURHAM, NC, 27705","932, MORREENE ROAD, CREST STREET, DURHAM, DURHAM COUNTY, NORTH CAROLINA, 27705, USA",36.0093755,-78.95514250000001
"2301 ERWIN RD, DURHAM, NC, 27705","DUKE UNIVERSITY HOSPITAL, 2301, ERWIN ROAD, CREST STREET, DURHAM, DURHAM COUNTY, NORTH CAROLINA, 27710, USA",36.0070213,-78.93734788
"2351 ERWIN RD, DURHAM, NC, 27705","DUKE EYE CENTER, 2351, ERWIN ROAD, CREST STREET, DURHAM, DURHAM COUNTY, NORTH CAROLINA, 27705, USA",36.00754165,-78.93916808
"1000 TRENT DR, DURHAM, NC, 27710","TRENT DRIVE, CREST STREET, DURHAM, DURHAM COUNTY, NORTH CAROLINA, 27705, USA",36.0087527,-78.9336344
"40 DUKE MEDICINE CIR, DURHAM, NC, 27710","DUKE CLINIC, 40, DUKE MEDICINE CIRCLE, CREST STREET, DURHAM, DURHAM COUNTY, NORTH CAROLINA, 27710, USA",36.0044614,-78.93606168
"123 WATERHOUSE RD, BOURNE, MA, 02532","123, WATERHOUSE ROAD, BOURNE, BARNSTABLE COUNTY, MASSACHUSETTS, 02532, USA",41.73348313,-70.58944706
"107 COMMERCIAL ST, MASHPEE, MA, 02649","107, COMMERCIAL STREET, MASHPEE, BARNSTABLE COUNTY, MASSACHUSETTS, 02649, USA",41.60734425,-70.49084526
"1001 SAM PERRY BLVD, FREDERICKSBURG, VA, 22401","MARY WASHINGTON HOSPITAL, 1001, SAM PERRY BOULEVARD, FREDERICKSBURG, FREDERICKSBURG CITY, VIRGINIA, 22401, USA",38.3102848,-77.48381273
"3000 HOSPITAL DR, BATAVIA, OH, 45103","MERCY HEALTH - CLERMONT HOSPITAL, 3000, HOSPITAL DRIVE, EAST BATAVIA HEIGHTS, BATAVIA TOWNSHIP, CLERMONT COUNTY, OHIO, 45103, USA",39.08006125,-84.14456188
"4777 E GALBRAITH RD, CINCINNATI, OH, 45236","EAST GALBRAITH ROAD, HARTWELL, CINCINNATI, HAMILTON COUNTY, OHIO, 45216, USA",39.212325899999996,-84.4709307
"471 AINSLEY AVE, YUBA CITY, CA, 95991","471, AINSLEY AVENUE, YUBA CITY, SUTTER COUNTY, CALIFORNIA, 95991, USA",39.14438244,-121.6198845
"7432 LITTLE RIVER TPKE, ANNANDALE, VA, 22003","7432, LITTLE RIVER TURNPIKE, ANNANDALE, FAIRFAX COUNTY, VIRGINIA, 22003, USA",38.83134335,-77.20117178
"3085 NUTLEY ST, FAIRFAX, VA, 22031","3085, NUTLEY STREET, MERRIFIELD, FAIRFAX COUNTY, VIRGINIA, 22031, USA",38.87201688,-77.26308458
"1816 B EUCALYPTUS AVE, ENCINITAS, CA, 92024","1816, EUCALYPTUS AVENUE, ENCINITAS, SAN DIEGO COUNTY, CALIFORNIA, 92024, USA",33.07931216,-117.305653
"407 W DELILAH RD, PLEASANTVILLE, NJ, 08232","407, WEST DELILAH ROAD, PLEASANT ACRES, PLEASANTVILLE, ATLANTIC COUNTY, NEW JERSEY, 08232, USA",39.40667592,-74.5176452
"807 CHILDRENS WAY, JACKSONVILLE, FL, 32207","NEMOURS CHILDREN'S SPECIALTY CARE, 807, CHILDRENS WAY, LAVILLA, JACKSONVILLE, DUVAL COUNTY, FLORIDA, 32207, USA",30.31302505,-81.66317796
"23845 MCBEAN PKWY, VALENCIA, CA, 91355","HENRY MAYO NEWHALL HOSPITAL, 23845, MCBEAN PARKWAY, VALENCIA, SANTA CLARITA, LOS ANGELES COUNTY, CALIFORNIA, 91355, USA",34.39790905,-118.5533298
"2202 WILSHIRE BLVD, SANTA MONICA, CA, 90403","2202, WILSHIRE BOULEVARD, SANTA MONICA, LOS ANGELES COUNTY, CALIFORNIA, 90403, USA",34.03278555,-118.48125929999999
"21230 DEQUINDRE RD, WARREN, MI, 48091","MSH, 21230, DEQUINDRE ROAD, HAZEL PARK, MACOMB COUNTY, MICHIGAN, 48091, USA",42.45171895,-83.08141862
"1900 COLUMBUS AVE, BAY CITY, MI, 48708","MCLAREN BAY REGION, 1900, COLUMBUS AVENUE, CITY OF BAY CITY, BAY COUNTY, MICHIGAN, 48708, USA",43.586645399999995,-83.8679985
"15 W WOOD ST, NORRISTOWN, PA, 19401","15, WEST WOOD STREET, NORRISTOWN, MONTGOMERY COUNTY, PENNSYLVANIA, 19401, USA",40.123922,-75.337406
"401 N 12TH ST, RICHMOND, VA, 23298","401, NORTH 12TH STREET, SHOCKOE SLIP, RICHMOND, RICHMOND CITY, VIRGINIA, 23298, USA",37.540153000000004,-77.430284
"1250 E MARSHALL ST, RICHMOND, VA, 23298","VCU MEDICAL CENTER, 1250, EAST MARSHALL STREET, SHOCKOE SLIP, RICHMOND, RICHMOND CITY, VIRGINIA, 23219, USA",37.5402575,-77.4300631
"200 E STATE ST, ALLIANCE, OH, 44601","ALLIANCE COMMUNITY HOSPITAL, 200, EAST STATE STREET, ALLIANCE, STARK COUNTY, OHIO, 44601, USA",40.903022299999996,-81.10275647
"11569 E 12 MILE RD, WARREN, MI, 48093","11569, EAST 12 MILE ROAD, WARREN, MACOMB COUNTY, MICHIGAN, 48093, USA",42.50714665,-83.00748264
"200 HAWKINS DR, IOWA CITY, IA, 52242","UNIVERSITY OF IOWA STEAD FAMILY CHILDREN’S HOSPITAL, 200, HAWKINS DRIVE, IOWA CITY, JOHNSON COUNTY, IOWA, 52242, USA",41.65869195,-91.54927058
"12011 SW 70TH AVE, TIGARD, OR, 97223","12011, SOUTHWEST 70TH AVENUE, TIGARD TRIANGLE, BONITA, TIGARD, WASHINGTON COUNTY, OREGON, 97223, USA",45.43295705,-122.7492765
"1331 E WYOMING AVE, PHILADELPHIA, PA, 19124","CANCER TREATMENT CENTERS OF AMERICA, 1331, EAST WYOMING AVENUE, NORTHWOOD, PHILADELPHIA, PHILADELPHIA COUNTY, PENNSYLVANIA, 19124, USA",40.0194205,-75.0988468
"3401 N BROAD ST, PHILADELPHIA, PA, 19140","TUH, 3401, NORTH BROAD STREET, NICETOWN, PHILADELPHIA, PHILADELPHIA COUNTY, PENNSYLVANIA, 19140, USA",40.0053079,-75.15082352
"2045 FAIRMONT DR, SAN LEANDRO, CA, 94578","FAIRMONT DRIVE, SAN LEANDRO, ALAMEDA COUNTY, CALIFORNIA, 94578, USA",37.7035643,-122.1258722
"3716 MELROSE AVE NW, ROANOKE, VA, 24017","NEW HORIZONS HEALTHCARE, 3716, MELROSE AVENUE NORTHWEST, WASHINGTON HEIGHTS, GROVE PARK, ROANOKE, VIRGINIA, 24017, USA",37.2938606,-79.99794016
"9961 SIERRA AVE, FONTANA, CA, 92335","KAISER PERMANENTE FONTANA MEDICAL CENTER, 9961, SIERRA AVENUE, FONTANA, SAN BERNARDINO COUNTY, CALIFORNIA, 92335, USA",34.0722265,-117.4334531
"3226 10TH AVE S, GREAT FALLS, MT, 59405","3226, 10TH AVENUE SOUTH, GREAT FALLS, CASCADE COUNTY, MONTANA, 59405, USA",47.49385588,-111.2513831
"2435 S TELSHOR BLVD, LAS CRUCES, NM, 88011","2435, SOUTH TELSHOR BOULEVARD, LAS CRUCES, DOÑA ANA COUNTY, NEW MEXICO, 88011, USA",32.30939337,-106.74028559999999
"310 S LIMESTONE, LEXINGTON, KY, 40508","GOOD SAMARITAN HOSPITAL, 310, SOUTH LIMESTONE, SOUTH HILL, LEXINGTON, FAYETTE COUNTY, KENTUCKY, 40508, USA",38.042196999999994,-84.50046629
"310 S LIMESTONE ST, LEXINGTON, KY, 40508","310, SOUTH LIMESTONE STREET, SOUTH HILL, LEXINGTON, FAYETTE COUNTY, KENTUCKY, 40508, USA",38.0431939,-84.50140543
"800 ROSE ST, LEXINGTON, KY, 40536","800, ROSE STREET, ACADEMIC CORE, LEXINGTON, FAYETTE COUNTY, KENTUCKY, 40506, USA",38.032771999999994,-84.506765
"830 S LIMESTONE, LEXINGTON, KY, 40536","UNIVERSITY HEALTH SERVICES, 830, SOUTH LIMESTONE, NORTH ELIZABETH STREET, LEXINGTON, FAYETTE COUNTY, KENTUCKY, 40508, USA",38.03230475,-84.50882074
"2416 DUNN AVE, JACKSONVILLE, FL, 32218","2416, DUNN AVENUE, JACKSONVILLE, DUVAL COUNTY, FLORIDA, 32218, USA",30.43880212,-81.68618691
"7503 SURRATTS RD, CLINTON, MD, 20735","MEDSTAR SOUTHERN MARYLAND HOSPITAL CENTER, 7503, SURRATTS ROAD, CLINTON, PRINCE GEORGE'S COUNTY, MARYLAND, 20735, USA",38.74841485,-76.8757199
"1215 RED RIVER ST, AUSTIN, TX, 78701","1215, RED RIVER STREET, MEDICAL DISTRICT, AUSTIN, TRAVIS COUNTY, TEXAS, 78701, USA",30.273102,-97.7347
"10251 W SAMPLE RD, CORAL SPRINGS, FL, 33065","10251, WEST SAMPLE ROAD, CORAL SPRINGS, BROWARD COUNTY, FLORIDA, 33065, USA",26.27269718,-80.26269108
"1836 S AVE, LA CROSSE, WI, 54601","1836, SOUTH AVENUE, LA CROSSE, LA CROSSE COUNTY, WISCONSIN, 54601, USA",43.79558591,-91.24750990000001
"106 BAKER RD, ARCHDALE, NC, 27263","106, BAKER ROAD, ARCHDALE, RANDOLPH COUNTY, NORTH CAROLINA, 27263, USA",35.91682495,-79.97377642
"203 POMONA DR, GREENSBORO, NC, 27407","203, POMONA DRIVE, GREENSBORO, GUILFORD COUNTY, NORTH CAROLINA, 27407, USA",36.06765007,-79.86153406
"10135 S DELAWARE AVE, TULSA, OK, 74137","10135, SOUTH DELAWARE AVENUE, DELAWARE POINTE, TULSA, TULSA COUNTY, OKLAHOMA, 74137, USA",36.01672239,-95.94883603
"555 E CHEVES ST, FLORENCE, SC, 29506","GROUCHO'S DELI, 555, EAST CHEVES STREET, FLORENCE, FLORENCE COUNTY, SOUTH CAROLINA, 29506, USA",34.1977396,-79.7563517
"1405 SPRING ST, JEFFERSONVILLE, IN, 47130","1405, SPRING STREET, JEFFERSONVILLE, CLARK COUNTY, INDIANA, 47130, USA",38.284231,-85.748559
"455 SAINT MICHAELS DR, SANTA FE, NM, 87505","CHRISTUS SAINT VINCENT REGIONAL MEDICAL CENTER, 455, SAINT MICHAELS DRIVE, SANTA FE, SANTA FE COUNTY, NEW MEXICO, 87505, USA",35.659295,-105.94616409999998
"2040 TENTH AVE, COLUMBUS, GA, 31901","10TH AVE, COLUMBUS, FRANKLIN COUNTY, OHIO, 43219, USA",39.989632,-82.928262
"710 CTR ST, COLUMBUS, GA, 31901","MIDTOWN MEDICAL CENTER, 710, CENTER STREET, COLUMBUS, MUSCOGEE COUNTY, GEORGIA, 31904, USA",32.4806319,-84.98273258
"100 FRIST CT, COLUMBUS, GA, 31909","PIEDMONT COLUMBUS REGIONAL NORTHSIDE CAMPUS, 100, FRIST COURT, SUNSHINE ACRES, COLUMBUS, MUSCOGEE COUNTY, GEORGIA, 31909, USA",32.53497465,-84.95122472
"2139 AUBURN AVE, CINCINNATI, OH, 45219","THE CHRIST HOSPITAL, 2139, AUBURN AVENUE, MOUNT AUBURN HISTORIC DISTRICT, MOUNT AUBURN, CINCINNATI, HAMILTON COUNTY, OHIO, 45219, USA",39.12083875,-84.51111282
"375 DIXMYTH AVE, CINCINNATI, OH, 45220","GOOD SAMARITAN HOSPITAL, 375, DIXMYTH AVENUE, UNIVERSITY HEIGHTS, CINCINNATI, HAMILTON COUNTY, OHIO, 45220, USA",39.13995295,-84.52174918
"489 STATE ST, BANGOR, ME, 04401","EASTERN MAINE MEDICAL CENTER, 489, STATE STREET, CHAPIN PARK (TREE STREETS), BANGOR, PENOBSCOT COUNTY, MAINE, 04401, USA",44.8084356,-68.75118548
"417 STATE ST, BANGOR, ME, 04401","417, STATE STREET, CHAPIN PARK (TREE STREETS), BANGOR, PENOBSCOT COUNTY, MAINE, 04401, USA",44.80811754,-68.75403904
"108 DENVER TRL, AZLE, TX, 76020","TEXAS HEALTH HARRIS METHODIST HOSPITAL AZLE, 108, DENVER TRAIL, AZLE, TARRANT COUNTY, TEXAS, 76020, USA",32.8801593,-97.53285441
"1301 PENNSYLVANIA AVE, FORT WORTH, TX, 76104","TEXAS HEALTH HARRIS METHODIST HOSPITAL FORT WORTH, 1301, PENNSYLVANIA AVENUE, FORT WORTH, TARRANT COUNTY, TEXAS, 76104, USA",32.7369675,-97.33885906
"815 PENNSYLVANIA AVE, FORT WORTH, TX, 76104","815, PENNSYLVANIA AVENUE, FORT WORTH, TARRANT COUNTY, TEXAS, 76104, USA",32.7375826,-97.33377104
"1500 S MAIN ST, FORT WORTH, TX, 76104","JOHN PETER SMITH HOSPITAL, 1500, SOUTH MAIN STREET, FORT WORTH, TARRANT COUNTY, TEXAS, 76104, USA",32.7270451,-97.32796715
"6100 HARRIS PKWY, FORT WORTH, TX, 76132","HARRIS METHODIST SOUTHWEST HOSPITAL, 6100, HARRIS PARKWAY, FORT WORTH, TARRANT COUNTY, TEXAS, 76132, USA",32.65776585,-97.42076356
"4401 BOOTH CALLOWAY RD, N RICHLAND HILLS, TX, 76180","MEDICAL CITY NORTH HILLS, 4401, BOOTH CALLOWAY ROAD, NORTH RICHLAND HILLS, TARRANT COUNTY, TEXAS, 76180, USA",32.8275548,-97.21295947
"6041 CADILLAC AVE, LOS ANGELES, CA, 90034","KAISER PERMANENTE WEST LOS ANGELES MEDICAL CENTER, 6041, CADILLAC AVENUE, SENTOUS, THE VILLAGE GREEN, LA, LOS ANGELES COUNTY, CALIFORNIA, 90034, USA",34.0387163,-118.3748104
"1301 15TH AVE W, WILLISTON, ND, 58801","CHI ST. ALEXIUS HEALTH - WILLISTON MEDICAL CENTER, 1301, 15TH AVENUE WEST, WILLISTON, WILLIAMS COUNTY, NORTH DAKOTA, 58801, USA",48.15609045,-103.6458437
"1213 15TH AVE W, WILLISTON, ND, 58801","1213, 15TH AVENUE WEST, WILLISTON, WILLIAMS COUNTY, NORTH DAKOTA, 58801, USA",48.154692,-103.645539
"101 3RD AVE SW, MINOT, ND, 58701","101, 3RD AVENUE SOUTHWEST, MINOT, WARD COUNTY, NORTH DAKOTA, 58701, USA",48.233359,-101.29578599999999
"1 BURDICK EXPY W, MINOT, ND, 58701","TRINITY HOSPITAL, 1, BURDICK EXPRESSWAY WEST, MINOT, WARD COUNTY, NORTH DAKOTA, 58702, USA",48.2323727,-101.2944768
"831 S BROADWAY, MINOT, ND, 58701","SOUTH BROADWAY, MINOT, WARD COUNTY, NORTH DAKOTA, 58707, USA",48.233959000000006,-101.29597700000001
