addr_string,matched_addr,lat,long
"2100 PFINGSTEN RD, GLENVIEW, IL, 60026","GLENBROOK HOSPITAL, 2100, PFINGSTEN ROAD, GLENVIEW, COOK COUNTY, ILLINOIS, 60026, USA",42.09247545,-87.85407304
"9600 GROSS POINT RD, SKOKIE, IL, 60076","SKOKIE HOSPITAL, 9600, GROSS POINT ROAD, SKOKIE, COOK COUNTY, ILLINOIS, 60076, USA",42.0563106,-87.74037745
"9650 GROSS POINT RD, SKOKIE, IL, 60076","9650, GROSS POINT ROAD, SKOKIE, COOK COUNTY, ILLINOIS, 60076, USA",42.05612313,-87.73911974
"2650 RIDGE AVE, EVANSTON, IL, 60201","EVANSTON HOSPITAL, 2650, RIDGE AVENUE, NORTH EVANSTON, EVANSTON, COOK COUNTY, ILLINOIS, 60201, USA",42.066132,-87.68429042
"1300 OAK AVE, EVANSTON, IL, 60201","1300, OAK AVENUE, DOWNTOWN, EVANSTON, COOK COUNTY, ILLINOIS, 60201, USA",42.0415249,-87.68734090000001
"2213 CHERRY ST, TOLEDO, OH, 43608","MERCY SAINT VINCENT MEDICAL CENTER, 2213, CHERRY STREET, BIRCKHEAD PLACE, TOLEDO, LUCAS COUNTY, OHIO, 43608, USA",41.66858445,-83.54269392
"2222 CHERRY ST, TOLEDO, OH, 43608","2222, CHERRY STREET, BIRCKHEAD PLACE, TOLEDO, LUCAS COUNTY, OHIO, 43608, USA",41.66884651,-83.54188601
"3404 W SYLVANIA AVE, TOLEDO, OH, 43623","MERCY HEALTH — ST. ANNE HOSPITAL, 3404, WEST SYLVANIA AVENUE, FRANKLIN PARK, TOLEDO, LUCAS COUNTY, OHIO, 43623, USA",41.69324665,-83.62524334
"1027 TOWN CTR DR, ORANGE CITY, FL, 32763","1027, TOWN CENTER DRIVE, ORANGE CITY, VOLUSIA COUNTY, FLORIDA, 32763, USA",28.90677724,-81.28698707
"1035 TOWN CTR DR, ORANGE CITY, FL, 32763","1035, TOWN CENTER DRIVE, ORANGE CITY, VOLUSIA COUNTY, FLORIDA, 32763, USA",28.90661927,-81.28716279
"1055 SAXON BLVD, ORANGE CITY, FL, 32763","FLORIDA HOSPITAL FISH MEMORIAL, 1055, SAXON BOULEVARD, ORANGE CITY, VOLUSIA COUNTY, FLORIDA, 32763, USA",28.915330400000002,-81.28491733
"801 OSTRUM ST, BETHLEHEM, PA, 18015","SAINT LUKE'S UNIVERSITY HOSPITAL - BETHLEHEM CAMPUS, 801, OSTRUM STREET, FOUNTAIN HILL, LEHIGH COUNTY, PENNSYLVANIA, 18015, USA",40.60928045,-75.3931974
"1021 PARK AVE, QUAKERTOWN, PA, 18951","SAINT LUKE'S HOSPITAL QUAKERTOWN CAMPUS, 1021, PARK AVENUE, QUAKERTOWN, BUCKS COUNTY, PENNSYLVANIA, 18951, USA",40.438722,-75.34886283
"757 WESTWOOD PLZ, LOS ANGELES, CA, 90095","RONALD REAGAN UCLA MEDICAL CENTER, 757, WESTWOOD PLAZA, WESTWOOD VILLAGE, WESTWOOD, LA, LOS ANGELES COUNTY, CALIFORNIA, 90095, USA",34.0664646,-118.4465068
"7401 MAIN ST, HOUSTON, TX, 77030","7401, FANNIN STREET, HOUSTON, HARRIS COUNTY, TEXAS, 77030, USA",29.701103999999997,-95.409001
"930 CHESTNUT RIDGE RD, MORGANTOWN, WV, 26505","CHESTNUT RIDGE ROAD, VIRGINIA MANOR, MORGANTOWN, MONONGALIA COUNTY, WEST VIRGINIA, 26505, USA",39.657898700000004,-79.95890899999999
"1 MEDICAL CTR DR, MORGANTOWN, WV, 26506","RUBY MEMORIAL HOSPITAL, 1, MEDICAL CENTER DRIVE, THE FLATTS, MORGANTOWN, MONONGALIA COUNTY, WEST VIRGINIA, 26506, USA",39.65446155,-79.95906632
"3815 N VERMILION ST, DANVILLE, IL, 61832","3815, NORTH VERMILION STREET, DANVILLE, VERMILION COUNTY, ILLINOIS, 61832, USA",40.19525866,-87.62943545
"9 PLEASANT ST, OAKLAND, ME, 04963","9, PLEASANT STREET, OAKLAND, KENNEBEC COUNTY, MAINE, 04963, USA",44.54839439,-69.71374178
"311 E CALIFORNIA ST, GAINESVILLE, TX, 76240","EAST CALIFORNIA STREET, GAINESVILLE, COOKE COUNTY, TEXAS, 76240, USA",33.6241662,-97.12709699999999
"410 BOLIVAR ST, SANGER, TX, 76266","410, BOLIVAR STREET, SANGER, DENTON COUNTY, TEXAS, 76266, USA",33.36218396,-97.17252601
"4900 BROAD RD, SYRACUSE, NY, 13215","UPSTATE UNIVERSITY HOSPITAL COMMUNITY CAMPUS, 4900, BROAD ROAD, ELMWOOD, SYRACUSE, TOWN OF ONONDAGA, ONONDAGA COUNTY, NEW YORK, 13215, USA",43.00726375,-76.16808353
"813 FAY RD, SYRACUSE, NY, 13219","813, FAY ROAD, WESTVALE, TOWN OF GEDDES, ONONDAGA COUNTY, NEW YORK, 13219, USA",43.03494379,-76.20877861
"2401 S 31ST ST, TEMPLE, TX, 76508","TEXAS A&M COLLEGE OF MEDICINE, 2401, SOUTH 31ST STREET, TEMPLE, BELL COUNTY, TEXAS, 76508, USA",31.076984799999998,-97.3625747
"3000 HERRING AVE, WACO, TX, 76708","OLD HILLCREST HOSPITAL, 3000, HERRING AVENUE, WACO, MCLENNAN COUNTY, TEXAS, 76708, USA",31.558994399999996,-97.1744939
"540 LITCHFIELD ST, TORRINGTON, CT, 06790","CHARLOTTE HUNGERFORD HOSPITAL, 540, LITCHFIELD STREET, TORRINGTON, LITCHFIELD COUNTY, CONNECTICUT, 06790, USA",41.79227045,-73.13376945
"1501 KRAFFT RD, FORT GRATIOT, MI, 48059","1501, KRAFFT ROAD, PORT HURON, SAINT CLAIR COUNTY, MICHIGAN, 48060, USA",43.025309,-82.448098
"1269 PARKER RD SE, CONYERS, GA, 30094","1269, PARKER ROAD SOUTHEAST, CONYERS, ROCKDALE COUNTY, GEORGIA, 30094, USA",33.6560268,-84.02042464
"3200 KEARNEY ST, FREMONT, CA, 94538","3200, KEARNEY STREET, CENTERVILLE DISTRICT, FREMONT, ALAMEDA COUNTY, CALIFORNIA, 94538, USA",37.54916022,-121.9748289
"2676 E AURORA RD, TWINSBURG, OH, 44087","2676, EAST AURORA ROAD, TWINSBURG, SUMMIT COUNTY, OHIO, 44087, USA",41.31134198,-81.44447640000001
"1202 S TYLER ST, COVINGTON, LA, 70433","SAINT TAMMANY PARISH HOSPITAL, 1202, SOUTH TYLER STREET, COVINGTON, ST. TAMMANY PARISH, LOUISIANA, 70433, USA",30.4682646,-90.11391089
"13652 CANTARA ST, PANORAMA CITY, CA, 91402","13652, CANTARA STREET, PANORAMA CITY, LA, LOS ANGELES COUNTY, CALIFORNIA, 91402, USA",34.21976159,-118.42969209999998
"571 MAIN ST, WEYMOUTH, MA, 02190","571, MAIN STREET, WEYMOUTH, NORFOLK COUNTY, MASSACHUSETTS, 02190, USA",42.187117,-70.955632
"4901 LAC DE VILLE BLVD, ROCHESTER, NY, 14618","LAC DE VILLE BOULEVARD, BRIGHTON, BRIGHTON TOWN, MONROE COUNTY, NEW YORK, 14618, USA",43.112214,-77.5931614
"901 NEVIN AVE, RICHMOND, CA, 94801","KAISER PERMANENTE RICHMOND MEDICAL CENTER, 901, NEVIN AVENUE, IRON TRIANGLE, RICHMOND, CONTRA COSTA COUNTY, CALIFORNIA, 94801, USA",37.9373338,-122.36096909999999
"210 SIMMONS ST, MARYVILLE, TN, 37801","210, SIMMONS STREET, MARYVILLE, BLOUNT COUNTY, TENNESSEE, 37801, USA",35.75128974,-83.97838341
"2570 HAYMAKER RD, MONROEVILLE, PA, 15146","FORBES HOSPITAL, 2570, HAYMAKER ROAD, MONROEVILLE, ALLEGHENY COUNTY, PENNSYLVANIA, 15146, USA",40.4289169,-79.7482277
"320 E N AVE, PITTSBURGH, PA, 15212","ALLEGHENY GENERAL HOSPITAL, 320, EAST NORTH AVENUE, CENTRAL NORTHSIDE, PGH, ALLEGHENY COUNTY, PENNSYLVANIA, 15212, USA",40.45696955,-80.00331139
"4800 FRIENDSHIP AVE, PITTSBURGH, PA, 15224","WESTERN PENNSYLVANIA HOSPITAL, 4800, FRIENDSHIP AVENUE, BLOOMFIELD, PGH, ALLEGHENY COUNTY, PENNSYLVANIA, 15224, USA",40.4612409,-79.94609008
"970 FREEPORT RD, PITTSBURGH, PA, 15238","FREEPORT ROAD, LINCOLN-LEMINGTON, LINCOLN-LEMINGTON-BELMAR, PGH, ALLEGHENY COUNTY, PENNSYLVANIA, 15215X, USA",40.4866437,-79.8906874
"0 -100, FAIR LAWN, NJ, 07410","FAIR LAWN, BERGEN COUNTY, NEW JERSEY, 07410, USA",40.9403762,-74.1318096
"161 E MAIN ST, DENVILLE, NJ, 07834","DENVILLE MEDICAL, 161, EAST MAIN STREET, DENVILLE, MORRIS COUNTY, NEW JERSEY, 07834, USA",40.887369,-74.479612
"1086 FRANKLIN ST, JOHNSTOWN, PA, 15905","CONEMAUGH MEMORIAL MEDICAL CENTER, 1086, FRANKLIN STREET, FERNDALE, CAMBRIA COUNTY, PENNSYLVANIA, 15905, USA",40.3058405,-78.91824395
"75 N COUNTRY RD, PORT JEFFERSON, NY, 11777","JOHN T. MATHER MEMORIAL HOSPITAL, 75, NORTH COUNTRY ROAD, PORT JEFFERSON, SUFFOLK COUNTY, NEW YORK, 11777, USA",40.9396773,-73.05330679
"3327 COLBY AVE, EVERETT, WA, 98201","3327, COLBY AVENUE, LOWELL, EVERETT, SNOHOMISH COUNTY, WASHINGTON, 98201, USA",47.973484899999995,-122.2082808
"365 W 1ST ST, TUSTIN, CA, 92780","365, WEST 1ST STREET, BROWNING, TUSTIN, ORANGE COUNTY, CALIFORNIA, 92780, USA",33.74573452,-117.82661359999999
"125 INDIAN ROCK RD, WINDHAM, NH, 03087","COCO, EARLY & ASSOCIATES, 125, INDIAN ROCK ROAD, WINDHAM, ROCKINGHAM COUNTY, NEW HAMPSHIRE, 03087, USA",42.807255700000006,-71.2628045
"19 WEBB PL, DOVER, NH, 03820","19, WEBB PLACE, DOVER, STRAFFORD COUNTY, NEW HAMPSHIRE, 03820, USA",43.22052487,-70.88906713
"1 PORTSMOUTH AVE, STRATHAM, NH, 03885","SALEM FIVE BANK, 1, PORTSMOUTH AVENUE, STRATHAM, ROCKINGHAM COUNTY, NEW HAMPSHIRE, 03885, USA",42.991600299999995,-70.92839000000001
"11 WHITEHALL RD, ROCHESTER, NH, 03867","FRISBIE MEMORIAL HOSPITAL, 11, WHITEHALL ROAD, ROCHESTER, STRAFFORD COUNTY, NEW HAMPSHIRE, 03867, USA",43.29683245,-70.9599128
"3234 S ALAMEDA ST, CORPUS CHRISTI, TX, 78404","3234, SOUTH ALAMEDA STREET, CORPUS CHRISTI, NUECES COUNTY, TEXAS, 78404, USA",27.754997600000003,-97.38867292
"610 30TH AVE W, ALEXANDRIA, MN, 56308","ALEXANDRIA CLINIC, 610, 30TH AVENUE WEST, ALEXANDRIA, DOUGLAS COUNTY, MINNESOTA, 56308, USA",45.862355799999996,-95.38619283
"15 W DRY CREEK CIRCLE, LITTLETON, CO, 80120","15, WEST DRY CREEK CIRCLE, LITTLETON, ARAPAHOE COUNTY, COLORADO, 80120, USA",39.580774,-104.990256
"10810 CONNECTICUT AVE, KENSINGTON, MD, 20895","10810, CONNECTICUT AVENUE, ROCK CREEK PALISADES, NORTH KENSINGTON, MONTGOMERY COUNTY, MARYLAND, 20895, USA",39.03370013,-77.0750275
"302 S MOORPARK RD, THOUSAND OAKS, CA, 91361","302, SOUTH MOORPARK ROAD, THOUSAND OAKS, VENTURA COUNTY, CALIFORNIA, 91361, USA",34.17505021,-118.87581429999999
"659 BOULEVARD ST, DOVER, OH, 44622","UNION HOSPITAL, 659, BOULEVARD STREET, DOVER, TUSCARAWAS COUNTY, OHIO, 44622, USA",40.514855,-81.45568229999999
"1275 YORK AVE, NEW YORK, NY, 10065","MEMORIAL SLOAN KETTERING CANCER CENTER, 1275, YORK AVENUE, LENOX HILL, MANHATTAN, MANHATTAN COMMUNITY BOARD 8, NEW YORK COUNTY, NYC, NEW YORK, 10065, USA",40.76445335,-73.95694408
"480 RED HILL RD, MIDDLETOWN, NJ, 07748","480, RED HILL ROAD, HOLMDEL TOWNSHIP, MONMOUTH COUNTY, NEW JERSEY, 07748, USA",40.37502954,-74.14619417
"2 TAMPA GENERAL CIR, TAMPA, FL, 33606","TAMPA GENERAL CIRCLE, HARBOUR ISLAND, TAMPA, HILLSBOROUGH COUNTY, FLORIDA, 33606, USA",27.937081699999997,-82.4584312
"200 1ST ST SW, ROCHESTER, MN, 55905","1ST STREET SOUTHWEST, ROCHESTER, OLMSTED COUNTY, MINNESOTA, 55903, USA",44.022446,-92.4680463
"522 N CTR ST, THOMASTON, GA, 30286","522, NORTH CENTER STREET, THOMASTON, UPSON COUNTY, GEORGIA, 30286, USA",32.89761931,-84.32816112
"100 N MACON ST, MACON, GA, 31210","NORTH MACON STREET, WESLEYAN HILLS, MACON, BIBB COUNTY, GEORGIA, 31210, USA",32.928331400000005,-83.73746440000001
"6262 VETERANS PKWY, COLUMBUS, GA, 31909","6262, VETERANS PARKWAY, PEPPERTREE, COLUMBUS, MUSCOGEE COUNTY, GEORGIA, 31909, USA",32.53479993,-84.95489188
"512 N SHADY LN, DOTHAN, AL, 36303","512, NORTH SHADY LANE, DOTHAN, HOUSTON COUNTY, ALABAMA, 36303, USA",31.236827500000004,-85.45174538
"4401 RIVER CHASE DR, PHENIX CITY, AL, 36867","JACK HUGHSTON MEMORIAL HOSPITAL, 4401, RIVER CHASE DRIVE, PHENIX CITY, LEE COUNTY, ALABAMA, 36867, USA",32.50797725,-85.00878469
"1301 PUNCHBOWL ST, HONOLULU, HI, 96813","THE QUEEN'S MEDICAL CENTER, 1301, PUNCHBOWL STREET, DOWNTOWN, HAWAII CAPITAL HISTORIC DISTRICT, HONOLULU, HONOLULU COUNTY, HAWAII, 96813, UNITED STATES OF AMERICA (MIDDLE HAWAI'IAN ISLANDS TERRITORIAL WATERS)",21.30799045,-157.853676
"3401 CIVIC CTR BLVD, PHILADELPHIA, PA, 19104","CHOP, 3401, CIVIC CENTER BOULEVARD, UNIVERSITY CITY, PHILADELPHIA, PHILADELPHIA COUNTY, PENNSYLVANIA, 19104, USA",39.94769755,-75.19498022
"1200 N ELM ST, GREENSBORO, NC, 27401","THE MOSES H. CONE MEMORIAL HOSPITAL, 1200, NORTH ELM STREET, GREENSBORO, GUILFORD COUNTY, NORTH CAROLINA, 27401, USA",36.0914674,-79.78629261
"2525 C PHILLIPS AVE, GREENSBORO, NC, 27405","2525, PHILLIPS AVENUE, GREENSBORO, GUILFORD COUNTY, NORTH CAROLINA, 27405, USA",36.09525899,-79.74555642
"25 N LANIER AVE, FORT MEADE, FL, 33841","25, NORTH LANIER AVENUE, FORT MEADE, POLK COUNTY, FLORIDA, 33841, USA",27.75293506,-81.80018134
"3800 RESERVOIR RD NW, WASHINGTON, DC, 20007","MEDSTAR GEORGETOWN UNIVERSITY HOSPITAL, 3800, RESERVOIR ROAD NORTHWEST, BURLEITH/HILLANDALE, GEORGETOWN, WASHINGTON, D.C., 20007, USA",38.91148265,-77.07519317
"1203 AVE B, ELLISVILLE, MS, 39437","ELLISVILLE MEDICAL CLINIC, 1203, AVENUE B, ELLISVILLE, JONES COUNTY, MISSISSIPPI, 39437, USA",31.61144235,-89.20770605
"1410 JEFFERSON ST, LAUREL, MS, 39440","1410, JEFFERSON STREET, QUEENSBURG, LAUREL, JONES COUNTY, MISSISSIPPI, 39440, USA",31.68590925,-89.14558441
"1430 JEFFERSON ST, LAUREL, MS, 39440","SOUTH CENTRAL URGENT CARE & INDUSTRIAL MEDICINE, 1430, JEFFERSON STREET, QUEENSBURG, LAUREL, JONES COUNTY, MISSISSIPPI, 39440, USA",31.6855951,-89.14435508
"1440 JEFFERSON ST, LAUREL, MS, 39440","1440, JEFFERSON STREET, QUEENSBURG, LAUREL, JONES COUNTY, MISSISSIPPI, 39440, USA",31.68591456,-89.14574054
"1220 JEFFERSON ST, LAUREL, MS, 39440","SOUTH CENTRAL REGIONAL MEDICAL CENTER, 1220, JEFFERSON STREET, QUEENSBURG, LAUREL, JONES COUNTY, MISSISSIPPI, 39440, USA",31.6851082,-89.14114781
"916 HOLDER ST, LARCHWOOD, IA, 51241","AVERA MEDICAL GROUP LARCHWOOD, 916, HOLDER STREET, LARCHWOOD, LYON COUNTY, IOWA, 51241, USA",43.4527625,-96.43297890000001
"1111 11TH ST, HAWARDEN, IA, 51023","HAWARDEN COMMUNITY HOSPITAL, 1111, 11TH STREET, HAWARDEN, SIOUX COUNTY, IOWA, 51023, USA",42.9984495,-96.48034613
"3000 S MINNESOTA AVE, SIOUX FALLS, SD, 57105","3000, SOUTH MINNESOTA AVENUE, DOWNTOWN SIOUX FALLS, SIOUX FALLS, MINNEHAHA COUNTY, SOUTH DAKOTA, 57105, USA",43.51757952,-96.73113394
"830 KEMPSVILLE RD, NORFOLK, VA, 23502","SENTARA LEIGH HOSPITAL, 830, KEMPSVILLE ROAD, JANAF, EASTON PLACE, NORFOLK, VIRGINIA, 23502, USA",36.85101595,-76.1898901
"1044 N FRANCISCO AVE, CHICAGO, IL, 60622","NORWEGIAN AMERICAN HOSPITAL, 1044, NORTH FRANCISCO AVENUE, HUMBOLDT PARK, CHICAGO, COOK COUNTY, ILLINOIS, 60622, USA",41.90143755,-87.69965948
"100 HIGH ST, BUFFALO, NY, 14203","BGMC, 100, HIGH STREET, FRUIT BELT, BUFFALO, ERIE COUNTY, NEW YORK, 14203, USA",42.901239399999994,-78.86579919
"101 DATES DR, ITHACA, NY, 14850","CAYUGA MEDICAL CENTER AT ITHACA, 101, DATES DR, NORTHWEST ITHACA, ITHACA TOWN, TOMPKINS COUNTY, NEW YORK, 14850, USA",42.4692583,-76.5374469
"1701 TWIN SPRINGS RD, HALETHORPE, MD, 21227","KAISER PERMANENTE MEDICAL CENTER, 1701, TWIN SPRINGS ROAD, HALETHORPE, LANSDOWNE, BALTIMORE COUNTY, MARYLAND, 21227, USA",39.25790595,-76.67372459
"720 N WEBB RD, GRAND ISLAND, NE, 68803","720, NORTH WEBB ROAD, GRAND ISLAND, HALL COUNTY, NEBRASKA, 68803, USA",40.92461996,-98.37862706
"220 W LEOTA ST, NORTH PLATTE, NE, 69101","WEST LEOTA STREET, NORTH PLATTE, LINCOLN COUNTY, NEBRASKA, 69101, USA",41.120756,-100.76852199999999
"214 MCHENRY RD, BUFFALO GROVE, IL, 60089","214, MCHENRY ROAD, LAKE COUNTY, ILLINOIS, 60089, USA",42.15581335,-87.95950065
"3134 N CLARK ST, CHICAGO, IL, 60657","ADVOCATE MEDICAL GROUP, 3134, NORTH CLARK STREET, PINE GROVE, LAKEVIEW, CHICAGO, COOK COUNTY, ILLINOIS, 60657, USA",41.93858265,-87.65018495
"836 W WELLINGTON AVE, CHICAGO, IL, 60657","ADVOCATE ILLINOIS MASONIC HOSPITAL, 836, WEST WELLINGTON AVENUE, LINCOLN PARK, LAKEVIEW, CHICAGO, COOK COUNTY, ILLINOIS, 60657, USA",41.93675815,-87.65126429
"836 W WELLINGTON, CHICAGO, IL, 60657","836, WEST WELLINGTON AVENUE, LINCOLN PARK, LAKEVIEW, CHICAGO, COOK COUNTY, ILLINOIS, 60657, USA",41.9364159,-87.6508441
"6434 W N AVE, CHICAGO, IL, 60707","6400-6434, WEST NORTH AVENUE, AUSTIN, OAK PARK, COOK COUNTY, ILLINOIS, 60302, USA",41.9096159,-87.78582848
"602 E NOB HILL BLVD, YAKIMA, WA, 98901","YAKIMA VALLEY FARM WORKERS CLINIC, 602, EAST NOB HILL BOULEVARD, YAKIMA, YAKIMA COUNTY, WASHINGTON, 98901, USA",46.5843225,-120.4938825
"3801 KERN RD, YAKIMA, WA, 98902","KERN ROAD, KITTITAS COUNTY, WASHINGTON, USA",46.90468,-120.376175
"3801 KERN WAY, YAKIMA, WA, 98902","3801, KERN WAY, RIVERVIEW MANOR, YAKIMA, YAKIMA COUNTY, WASHINGTON, 98908, USA",46.61083976,-120.55902549999999
"713 MEMORIAL ST, PROSSER, WA, 99350","713, MEMORIAL STREET, PROSSER, BENTON COUNTY, WASHINGTON, 99350, USA",46.20782902,-119.76366399999999
"701 PARK AVE, MINNEAPOLIS, MN, 55415","PARK AVENUE, MARCY-HOLMES, PHILLIPS, MINNEAPOLIS, HENNEPIN COUNTY, MINNESOTA, 55415, USA",44.9771711,-93.2590608
"790 W 66TH ST, RICHFIELD, MN, 55423","790, WEST 66TH STREET, RICHFIELD, HENNEPIN COUNTY, MINNESOTA, 55423, USA",44.883466999999996,-93.28805794
"435 SHREWSBURY ST, WORCESTER, MA, 01604","435, SHREWSBURY STREET, THE CANAL DISTRICT, WORCESTER, MASSACHUSETTS, 01604, USA",42.2722465,-71.7732132
"2030 STRINGTOWN RD, GROVE CITY, OH, 43123","2030, STRINGTOWN ROAD, GROVE CITY, JACKSON TOWNSHIP, FRANKLIN COUNTY, OHIO, 43123, USA",39.87852124,-83.05745115
"290 E TOWN ST, COLUMBUS, OH, 43215","290, TOWN ST, DISCOVERY DISTRICT, COLUMBUS, FRANKLIN COUNTY, OHIO, 43215, USA",39.95977233,-82.99235509
"393 E TOWN ST, COLUMBUS, OH, 43215","393, TOWN ST, EAST TOWN STREET HISTORIC DISTRICT, COLUMBUS, FRANKLIN COUNTY, OHIO, 43215, USA",39.95993678,-82.98944548
"2950 ELMWOOD AVE, KENMORE, NY, 14217","KENMORE MERCY HOSPITAL, 2950, ELMWOOD AVENUE, TONAWANDA, TONAWANDA TOWN, ERIE COUNTY, NEW YORK, 14217, USA",42.97795565,-78.88068243
"24800 SE STARK ST, GRESHAM, OR, 97030","LEGACY MOUNT HOOD MEDICAL CENTER, 24800, SOUTHEAST STARK STREET, TWELVEMILE CORNER, GRESHAM, MULTNOMAH COUNTY, OREGON, 97030, USA",45.5179129,-122.406426
"25050 SE STARK ST, GRESHAM, OR, 97030","25050, SOUTHEAST STARK STREET, TWELVEMILE CORNER, GRESHAM, MULTNOMAH COUNTY, OREGON, 97060, USA",45.51914673,-122.4054331
"1015 NW 22ND AVE, PORTLAND, OR, 97210","LEGACY GOOD SAMARITAN MEDICAL CENTER, 1015, NORTHWEST 22ND AVENUE, NORTHWEST DISTRICT, PORTLAND, MULTNOMAH COUNTY, OREGON, 97210, USA",45.5305258,-122.6976216
"2801 N GANTENBEIN AVE, PORTLAND, OR, 97227","LEGACY EMANUEL MEDICAL CENTER, 2801, NORTH GANTENBEIN AVENUE, ALBINA, ELIOT, PORTLAND, MULTNOMAH COUNTY, OREGON, 97227, USA",45.54389265,-122.6700328
"1130 NE 22ND AVE, PORTLAND, OR, 97210","NORTHEAST 22ND AVENUE, KERNS, PORTLAND, MULTNOMAH COUNTY, OREGON, 97232, USA",45.5272111,-122.643442
"24800 SE STARK ST, PORTLAND, OR, 97030","SOUTHEAST STARK STREET, RUSSELLVILLE, HAZELWOOD, PORTLAND, MULTNOMAH COUNTY, OREGON, 97216, USA",45.5190531,-122.5631627
"19300 SW 65TH AVE, TUALATIN, OR, 97062","LEGACY MERIDIAN PARK MEDICAL CENTER, 19300, SOUTHWEST 65TH AVENUE, TUALATIN, WASHINGTON COUNTY, OREGON, 97062, USA",45.37834965,-122.74146329999999
"315 W HICKORY ST, SYLACAUGA, AL, 35150","CVMC, 315, WEST HICKORY STREET, SYLACAUGA, TALLADEGA COUNTY, ALABAMA, 35150, USA",33.1651887,-86.25564905
"3690 GRANDVIEW PKWY, BIRMINGHAM, AL, 35243","GRANDVIEW MEDICAL CENTER, 3690, GRANDVIEW PARKWAY, BIRMINGHAM, JEFFERSON COUNTY, ALABAMA, 35243, USA",33.43337025,-86.71804887
"843 MILLING AVE, LULING, LA, 70070","843, MILLING AVENUE, LULING, ST. CHARLES PARISH, LOUISIANA, 70070, USA",29.92418959,-90.3693684
"16004 RIVER RD, NORCO, LA, 70079","RIVER ROAD, NORCO, ST. CHARLES PARISH, LOUISIANA, 70079, USA",29.9962756,-90.4117854
"2807 S COLUMBIA ST, BOGALUSA, LA, 70427","2807, SOUTH COLUMBIA STREET, BOGALUSA, WASHINGTON PARISH, LOUISIANA, 70427, USA",30.74234083,-89.84881661
"501 ROBERT BLVD, SLIDELL, LA, 70458","501, ROBERT BOULEVARD, SLIDELL, ST. TAMMANY PARISH, LOUISIANA, 70458, USA",30.29889165,-89.75927002
"1850 BLUEGRASS AVE, LOUISVILLE, KY, 40215","1850, BLUEGRASS AVENUE, LOUISVILLE, JEFFERSON COUNTY, KENTUCKY, 40215, USA",38.178445700000005,-85.7935316
"1406 W 5TH ST, LONDON, KY, 40741","1406, WEST 5TH STREET, LONDON, LAUREL COUNTY, KENTUCKY, 40741, USA",37.11401563,-84.09741416
"160 LONDON MOUNTAIN VIEW DR, LONDON, KY, 40741","LONDON MOUNTAIN VIEW DRIVE, LONDON, LAUREL COUNTY, KENTUCKY, 40755, USA",37.1513725,-84.1185225
"330 MOUNT AUBURN ST, CAMBRIDGE, MA, 02138","MOUNT AUBURN HOSPITAL, 330, MOUNT AUBURN STREET, COOLIDGE HILL, CAMBRIDGE, MIDDLESEX COUNTY, MASSACHUSETTS, 02138, USA",42.37413765,-71.13425215
"201 E NICOLLET BLVD, BURNSVILLE, MN, 55337","FAIRVIEW RIDGES HOSPITAL, 201, EAST NICOLLET BOULEVARD, BURNSVILLE, DAKOTA COUNTY, MINNESOTA, 55337, USA",44.74831435,-93.27274318
"4050 COON RAPIDS BLVD NW, COON RAPIDS, MN, 55433","MERCY HOSPITAL, 4050, COON RAPIDS BOULEVARD NORTHWEST, COON RAPIDS, ANOKA COUNTY, MINNESOTA, 55433, USA",45.1823604,-93.36871616
"212 FOUST ST, ASHEBORO, NC, 27203","212, FOUST STREET, ASHEBORO, RANDOLPH COUNTY, NORTH CAROLINA, 27203, USA",35.712006200000005,-79.81526711
"35 MEMORIAL DR, PINEHURST, NC, 28374","35, MEMORIAL DRIVE, PINEHURST, MOORE COUNTY, NORTH CAROLINA, 28374, USA",35.20585975,-79.46099007
"705 PLEASANT AVE S, PARK RAPIDS, MN, 56470","705, PLEASANT AVENUE SOUTH, PARK RAPIDS, HUBBARD COUNTY, MINNESOTA, 56470, USA",46.91496533,-95.06159251
"830 OLD LANCASTER RD, BRYN MAWR, PA, 19010","830, OLD LANCASTER ROAD, WYNNEWOOD, LOWER MERION TOWNSHIP, DELAWARE COUNTY, PENNSYLVANIA, 19010, USA",40.02012216,-75.32165895
"130 S BRYN MAWR AVE, BRYN MAWR, PA, 19010","BRYN MAWR HOSPITAL, 130, SOUTH BRYN MAWR AVENUE, LOWER MERION TOWNSHIP, MONTGOMERY COUNTY, PENNSYLVANIA, 19010, USA",40.0193369,-75.32109563
"600 COFFEE RD, MODESTO, CA, 95355","600, COFFEE ROAD, MODESTO, STANISLAUS COUNTY, CALIFORNIA, 95355, USA",37.652809000000005,-120.97546000000001
"2800 L ST, SACRAMENTO, CA, 95816","2800, L STREET, SACRAMENTO, SACRAMENTO COUNTY, CALIFORNIA, 95816, USA",38.571529999999996,-121.47004799999999
"153 CESAR CHAVEZ ST, SAINT PAUL, MN, 55107","153, CESAR CHAVEZ STREET, ST. PAUL, RAMSEY COUNTY, MINNESOTA, 55107, USA",44.92960814,-93.07731953
"7190 CRESTWOOD BLVD, FREDERICK, MD, 21703","CRESTWOOD BOULEVARD, BALLENGER CREEK, FREDERICK COUNTY, MARYLAND, 21703, USA",39.3912828,-77.4288392
"1117 SPRING ST, FRIDAY HARBOR, WA, 98250","PEACEHEALTH PEACE ISLAND MEDICAL CENTER, 1117, SPRING STREET, FRIDAY HARBOR, SAN JUAN COUNTY, WASHINGTON, 98250, USA",48.52665095,-123.0295557
"3015 SQUALICUM PKWY, BELLINGHAM, WA, 98225","3015, SQUALICUM PARKWAY, BELLINGHAM, WHATCOM COUNTY, WASHINGTON, 98225, USA",48.77229489,-122.46967579999999
"3001 S JACKSON ST, SAN ANGELO, TX, 76904","3001, SOUTH JACKSON STREET, RIO VISTA, SAN ANGELO, TOM GREEN COUNTY, TEXAS, 76903, USA",31.43259335,-100.45628420000001
"4545 HARTFORD ST, ABILENE, TX, 79605","4545, HARTFORD STREET, MEADOWS MOBILE HOME PARK, ABILENE, TAYLOR COUNTY, TEXAS, 79605, USA",32.43314633,-99.78180447
"1901 W HARRISON ST, CHICAGO, IL, 60612","FANTUS HEALTH CENTER, 1901, WEST HARRISON STREET, ILLINOIS MEDICAL DISTRICT, COOK COUNTY, ILLINOIS, 60612, USA",41.8724872,-87.67540290000001
"5912 W CERMAK RD, CICERO, IL, 60804","WEST CERMAK ROAD, CICERO, COOK COUNTY, ILLINOIS, 60804, USA",41.851269099999996,-87.74894599999999
"267 GRANT ST, BRIDGEPORT, CT, 06610","BRIDGEPORT HOSPITAL, 267, GRANT STREET, HISTORIC EAST SIDE, BRIDGEPORT, FAIRFIELD, CONNECTICUT, 06610, USA",41.18947085,-73.1674697
"30 PROSPECT AVE, HACKENSACK, NJ, 07601","HACKENSACKUMC, 30, PROSPECT AVENUE, HACKENSACK, BERGEN COUNTY, NEW JERSEY, 07601, USA",40.8837051,-74.05594088
"108 E 91ST ST, NEW YORK, NY, 10128","108, EAST 91ST STREET, CARNEGIE HILL, MANHATTAN, MANHATTAN COMMUNITY BOARD 8, NEW YORK COUNTY, NYC, NEW YORK, 10128, USA",40.7829332,-73.95439473
"2923 O ST, LINCOLN, NE, 68510","2923, O STREET, CLINTON, HAYMARKET, LINCOLN, LANCASTER COUNTY, NEBRASKA, 68510, USA",40.81333422,-96.67927018
"225 E CHICAGO AVE, CHICAGO, IL, 60611","ANN & ROBERT H. LURIE CHILDREN'S HOSPITAL, 225, EAST CHICAGO AVENUE, MAGNIFICENT MILE, SOUTH LOOP, CHICAGO, COOK COUNTY, ILLINOIS, 60611, USA",41.89624405,-87.6218314
"433 CHURCH ST, NEW MILFORD, PA, 18834","433, CHURCH STREET, NEW MILFORD, SUSQUEHANNA COUNTY, PENNSYLVANIA, 18834, USA",41.87854266,-75.72598093
"355 BARD AVE, STATEN ISLAND, NY, 10310","RUMC, 355, BARD AVENUE, WEST NEW BRIGHTON, RICHMOND COUNTY, NYC, NEW YORK, 10310, USA",40.636172200000004,-74.1055314
"5350 MADISON AVE, SACRAMENTO, CA, 95841","5350, MADISON AVENUE, FOOTHILL FARMS, SACRAMENTO COUNTY, CALIFORNIA, 95841, USA",38.66066926,-121.3395781
"1190 WAIANUENUE AVE, HILO, HI, 96720","HILO MEDICAL CENTER, 1190, WAIANUENUE AVENUE, PIʻIHONUA, HILO CDP, HAWAIʻI COUNTY, HAWAII, 96720, UNITED STATES OF AMERICA (ISLAND OF HAWAI'I TERRITORIAL WATERS)",19.71850165,-155.1123815
"6500 W NEWBERRY RD, GAINESVILLE, FL, 32605","NORTH FLORIDA REGIONAL MEDICAL CENTER, 6500, WEST NEWBERRY ROAD, DURANT ESTATES, CITY OF GAINESVILLE MUNICIPAL BOUNDARIES, ALACHUA COUNTY, FLORIDA, 32605, USA",29.66199805,-82.41118341
"4235 SUNBEAM RD, JACKSONVILLE, FL, 32257","4235, SUNBEAM ROAD, BAYMEADOWS, JACKSONVILLE, DUVAL COUNTY, FLORIDA, 32257, USA",30.20595531,-81.60409015
"1 GUSTAVE L LEVY PLACE, NEW YORK, NY, 10029","1, GUSTAVE L. LEVY PLACE, EAST HARLEM, MANHATTAN, MANHATTAN COMMUNITY BOARD 11, NEW YORK COUNTY, NYC, NEW YORK, 10029, USA",40.79038189999999,-73.95339090000002
"200 STRAHL ST, FRANKLIN, TN, 37064","200, STRAHL STREET, RIVER CLUB ESTATES, FRANKLIN, WILLIAMSON COUNTY, TENNESSEE, 37064, USA",35.916348,-86.87776
"133 BENMORE DR, WINTER PARK, FL, 32792","133, BENMORE DRIVE, WINTER PARK, ORANGE COUNTY, FLORIDA, 32792, USA",28.59577986,-81.32718947
"4861 CONVOY ST, SAN DIEGO, CA, 92111","CONVOY STREET, KEARNY MESA, SAN DIEGO, SAN DIEGO COUNTY, CALIFORNIA, 92111-2201, USA",32.814688000000004,-117.1534354
"5 TAMPA GENERAL CIR, TAMPA, FL, 33606","TAMPA GENERAL CIRCLE, HARBOUR ISLAND, TAMPA, HILLSBOROUGH COUNTY, FLORIDA, 33606, USA",27.937081699999997,-82.4584312
"900 POTOMAC ST, AURORA, CO, 80011","HEALTHONE SPALDING REHABILITATION HOSPITAL, 900, POTOMAC STREET, AURORA, ARAPAHOE COUNTY, COLORADO, 80011, USA",39.73112295,-104.827411
"85 1ST AVE NW, HUTCHINSON, MN, 55350","85, 1ST AVENUE NORTHWEST, HUTCHINSON, MCLEOD COUNTY, MINNESOTA, 55350, USA",44.89350158,-94.37041579
"10100 SE SUNNYSIDE RD, CLACKAMAS, OR, 97015","SOUTHEAST SUNNYSIDE ROAD, HAPPY VALLEY, CLACKAMAS COUNTY, OREGON, 97015, USA",45.4249739,-122.51729089999999
"10180 SE SUNNYSIDE RD, CLACKAMAS, OR, 97015","KAISER SUNNYSIDE MEDICAL CENTER, 10180, SOUTHEAST SUNNYSIDE ROAD, SUNNYSIDE, CLACKAMAS COUNTY, OREGON, 97015, USA",45.43149725,-122.55981909999998
"2400 LANCASTER DR NE, SALEM, OR, 97305","2400, LANCASTER DRIVE NORTHEAST, OAK PARK, SALEM, MARION COUNTY, OREGON, 97305, USA",44.95785428,-122.98374409999998
"5125 SKYLINE RD S, SALEM, OR, 97306","KAISER SKYLINE MEDICAL OFFICE, 5125, SKYLINE ROAD SOUTH, SUNNYSLOPE, LIBERTY, SALEM, MARION COUNTY, OREGON, 97306, USA",44.8824444,-123.07214520000001
