addr_string,matched_addr,lat,long
"1030 COMMERCE CREEK BLVD,CAPE CORAL,FL,33909","COMMERCE CREEK BOULEVARD, CASA DI FIORI, CAPE CORAL, LEE COUNTY, FLORIDA, 33909, USA",26.681216,-81.91962
"7900 AIRWAYS BLVD,SOUTHAVEN,MS,38671","7900, AIRWAYS BOULEVARD, SOUTHAVEN, DESOTO COUNTY, MISSISSIPPI, 38671, USA",34.97600458,-89.98978501
"1871 SE TIFFANY AVE,PORT SAINT LUCIE,FL,34952","1871, SOUTHEAST TIFFANY AVENUE, PORT ST. LUCIE, ST. LUCIE COUNTY, FLORIDA, 34952, USA",27.29016091,-80.29529556
"3440 E LA PALMA AVE,ANAHEIM,CA,92806","KAISER PERMANENTE ORANGE COUNTY – ANAHEIM MEDICAL CENTER, 3440, EAST LA PALMA AVENUE, ANAHEIM, ORANGE COUNTY, CALIFORNIA, 92806, USA",33.8525419,-117.84445929999998
"10 UNION SQ E,NEW YORK,NY,10003","MOUNT SINAI URGENT CARE CENTER, 10, UNION SQUARE EAST, UNION SQUARE, MANHATTAN, MANHATTAN COMMUNITY BOARD 2, NEW YORK COUNTY, NYC, NEW YORK, 10003, USA",40.734864,-73.98978819999999
"24 E MAIN ST,BAY SHORE,NY,11706","EAST MAIN STREET, BAY SHORE, SUFFOLK COUNTY, NEW YORK, 11706, USA",40.722913,-73.24598
"10401 W THUNDERBIRD BLVD,SUN CITY,AZ,85351","BANNER BOSWELL MEDICAL CENTER, 10401, WEST THUNDERBIRD BOULEVARD, EL MIRAGE, MARICOPA COUNTY, ARIZONA, 85351, USA",33.60265820000001,-112.2837711
"4000 CAMBRIDGE ST,KANSAS CITY,KS,66160","THE UNIVERSITY OF KANSAS HOSPITAL, 4000, CAMBRIDGE STREET, KANSAS CITY, WYANDOTTE COUNTY, KANSAS, 66160, USA",39.05592670000001,-94.6090332
"1802 6TH AVE S,BIRMINGHAM,AL,35233","UAB HOSPITAL, 1802, 6TH AVENUE SOUTH, AUTOMOTIVE HISTORIC DISTRICT, SMITHFIELD, BIRMINGHAM, JEFFERSON COUNTY, ALABAMA, 35233, USA",33.506324600000006,-86.80212218
"2000 6TH AVE S,BIRMINGHAM,AL,35233","KIRKLIN CLINIC, 2000, 6TH AVENUE SOUTH, AUTOMOTIVE HISTORIC DISTRICT, SMITHFIELD, BIRMINGHAM, JEFFERSON COUNTY, ALABAMA, 35233, USA",33.5079541,-86.80027802
"1660 SPRING HILL AVE                    ,MOBILE                   ,AL,36604","1660, SPRING HILL AVENUE, LYONS PARK, MOBILE, MOBILE COUNTY, ALABAMA, 36604, UNITED STATES OF AMERICA",30.692438,-88.076923
"1 MEDICAL PARK                          ,WHEELING                 ,WV,26003","WHEELING HOSPITAL, 1, MEDICAL PARK, WHEELING, OHIO COUNTY, WEST VIRGINIA, 26003, UNITED STATES",40.05853955,-80.6845955206454
"200 HAWTHORNE LN                        ,CHARLOTTE                ,NC,28204","HEMBY CHILDREN'S HOSPITAL, 200, HAWTHORNE LANE, MYERS PARK, CHARLOTTE, MECKLENBURG COUNTY, NORTH CAROLINA, 28204, UNITED STATES OF AMERICA",35.2127722,-80.8243454
"75 BEEKMAN ST                           ,PLATTSBURGH              ,NY,12901","CHAMPLAIN VALLEY PHYSICIANS HOSPITAL, 75, BEEKMAN STREET, PLATTSBURGH, CLINTON COUNTY, NEW YORK, 12901, UNITED STATES",44.7008404,-73.4691461567899
"500 W BROADWAY ST                       ,MISSOULA                 ,MT,59802","SAINT PATRICK HOSPITAL, 500, WEST BROADWAY STREET, MISSOULA, MISSOULA COUNTY, MONTANA, 59802, UNITED STATES",46.87514785,-114.000263514346
"119 BELMONT ST                          ,WORCESTER                ,MA,01605","UMASS MEMORIAL MEDICAL CENTER - MEMORIAL CAMPUS, 119, BELMONT STREET, LINCOLN SQUARE, WORCESTER, WORCESTER COUNTY, MASSACHUSETTS, 01605, UNITED STATES OF AMERICA",42.27290905,-71.7922374433663
"1 MEDICAL CENTER BLVD                   ,CHESTER                  ,PA,19013","CROZER-CHESTER MEDICAL CENTER, 1, MEDICAL CENTER BOULEVARD, CHESTER, DELAWARE COUNTY, PENNSYLVANIA, 19013, UNITED STATES",39.85541155,-75.3682502101832
"900 ILLINOIS AVE                        ,STEVENS POINT            ,WI,54481","ASCENSION ST. MICHAEL'S HOSPITAL, 900, ILLINOIS AVENUE, STEVENS POINT, PORTAGE COUNTY, WISCONSIN, 54481, UNITED STATES",44.52691005,-89.5670698754978
"225 E CHICAGO AVE                       ,CHICAGO                  ,IL,60611","ANN & ROBERT H. LURIE CHILDREN'S HOSPITAL, 225, EAST CHICAGO AVENUE, MAGNIFICENT MILE, NEAR NORTH SIDE, CHICAGO, COOK COUNTY, ILLINOIS, 60611, UNITED STATES",41.89624405,-87.62183140068909
"808 S 52ND ST                           ,ROGERS                   ,AR,72758","808, SOUTH 52ND STREET, ROGERS, BENTON COUNTY, ARKANSAS, 72758, UNITED STATES OF AMERICA",36.324689,-94.18669279999999
"1128 S PARK ST                          ,CARROLLTON               ,GA,30117","SOUTHWIRE - FITNESS CENTER, 1128, SOUTH PARK STREET, CARROLLTON, CARROLL COUNTY, GEORGIA, 30117, UNITED STATES OF AMERICA",33.55943565,-85.0717896208219
"3300 MAIN ST                            ,SPRINGFIELD              ,MA,01107","3300 MAIN STREET, MAIN STREET, SPRINGFIELD, HAMPDEN COUNTY, MASSACHUSETTS, 01107, UNITED STATES OF AMERICA",42.123165,-72.609741
"1901 SW H K DODGEN LOOP                 ,TEMPLE                   ,TX,76502","1901, SOUTHWEST H K DODGEN LOOP, TEMPLE, BELL COUNTY, TEXAS, 76502, UNITED STATES OF AMERICA",31.074732,-97.37552600000001
"200 HAWKINS DR                          ,IOWA CITY                ,IA,52242","UNIVERSITY OF IOWA STEAD FAMILY CHILDREN’S HOSPITAL, 200, HAWKINS DRIVE, IOWA CITY, JOHNSON COUNTY, IOWA, 52242, UNITED STATES OF AMERICA",41.65868815,-91.5492705899793
"1150 45TH ST                            ,WEST PALM BEACH          ,FL,33407","45TH STREET, WEST PALM BEACH, PALM BEACH COUNTY, FLORIDA, 33407, UNITED STATES",26.753038399999998,-80.0602504
"1011 W BALTIMORE PIKE                   ,WEST GROVE               ,PA,19390","WEST BALTIMORE PIKE, LONDON GROVE TOWNSHIP, CHESTER COUNTY, PENNSYLVANIA, 19390, UNITED STATES OF AMERICA",39.820692799999996,-75.8373709
"100 N RIVER RD                          ,DES PLAINES              ,IL,60016","PRESENCE HOLY FAMILY MEDICAL CENTER, 100, NORTH RIVER ROAD, DES PLAINES, COOK COUNTY, ILLINOIS, 60016, UNITED STATES",42.0563788,-87.8913467956053
"311 E MATTHEWS AVE                      ,JONESBORO                ,AR,72401","311, EAST MATTHEWS AVENUE, JONESBORO, CRAIGHEAD COUNTY, ARKANSAS, 72401, UNITED STATES",35.8356723262905,-90.70211571703871
"505 S PLUMMER AVE                       ,CHANUTE                  ,KS,66720","505, SOUTH PLUMMER AVENUE, CHANUTE, NEOSHO COUNTY, KANSAS, 66720, UNITED STATES",37.677409000000004,-95.470988
"3188 N WINDSONG DR                      ,PRESCOTT VALLEY          ,AZ,86314","3188, NORTH WINDSONG DRIVE, PRESCOTT VALLEY, YAVAPAI COUNTY, ARIZONA, 86314, UNITED STATES OF AMERICA",34.5872077168172,-112.326903221074
"315 W CARPENTER ST                      ,SPRINGFIELD              ,IL,62702","SIMMONS CANCER INSTITUTE, 315, WEST CARPENTER STREET, VINEGAR HILL, SPRINGFIELD, SANGAMON COUNTY, ILLINOIS, 62702, UNITED STATES OF AMERICA",39.8082507,-89.65832675034191
"400 S 43RD ST                           ,RENTON                   ,WA,98055","VALLEY MEDICAL CENTER, 400, SOUTH 43RD STREET, VICTORIA HILLS, RENTON, KING COUNTY, WASHINGTON, 98055, UNITED STATES OF AMERICA",47.4433094,-122.213964060406
"760 OFFICE PKWY                         ,SAINT LOUIS              ,MO,63141","760, OFFICE PARKWAY, CREVE COEUR EXECUTIVE OFFICE PARK, CREVE COEUR, SAINT LOUIS COUNTY, MISSOURI, 63141, UNITED STATES OF AMERICA",38.67012025,-90.4329222291284
"1309 N FLAGLER DR                       ,WEST PALM BEACH          ,FL,33401","GOOD SAMARITAN HOSPITAL, 1309, NORTH FLAGLER DRIVE, WEST PALM BEACH, PALM BEACH COUNTY, FLORIDA, 33401, UNITED STATES",26.72499255,-80.05156684186959
"1201 CAMINO DE SALUD NE                 ,ALBUQUERQUE              ,NM,87102","CAMINO DE SALUD NORTHEAST, MARTINEZ TOWN, ALBUQUERQUE, BERNALILLO COUNTY, NEW MEXICO, 87131, UNITED STATES",35.0963748,-106.63150690000002
"750 MORPHY AVE                          ,FAIRHOPE                 ,AL,36532","THOMAS HOSPITAL, 750, MORPHY AVENUE, FAIRHOPE, BALDWIN COUNTY, ALABAMA, 36532, UNITED STATES OF AMERICA",30.51903605,-87.8883517470515
"1 MEDICAL CENTER DR                     ,MORGANTOWN               ,WV,26506","RUBY MEMORIAL HOSPITAL, 1, MEDICAL CENTER DRIVE, THE FLATTS, MORGANTOWN, MONONGALIA COUNTY, WEST VIRGINIA, 26506, UNITED STATES",39.65446155,-79.95906632241659
"350 N MERIDIAN ST                       ,BLACKFOOT                ,ID,83221","IDAHO DOCTORS' HOSPITAL, 350, NORTH MERIDIAN STREET, BLACKFOOT, BINGHAM COUNTY, IDAHO, 83221, UNITED STATES",43.195951799999996,-112.3549159
"515 N ELAM AVE                          ,GREENSBORO               ,NC,27403","515, NORTH ELAM AVENUE, GREENSBORO, GUILFORD COUNTY, NORTH CAROLINA, 27403, UNITED STATES",36.082929406717,-79.8249548943588
"212 MULBERRY ST SW                      ,LENOIR                   ,NC,28645","212, MULBERRY STREET SOUTHWEST, LENOIR, CALDWELL COUNTY, NORTH CAROLINA, 28645, UNITED STATES OF AMERICA",35.9116725102041,-81.53701820408159
"701 GROVE RD                            ,GREENVILLE               ,SC,29605","FARIS RD @ GHS, 701, GROVE ROAD, GREENVILLE, GREENVILLE COUNTY, SOUTH CAROLINA, 29605, UNITED STATES OF AMERICA",34.8160716,-82.4136008
"2401 ATHERHOLT RD                       ,LYNCHBURG                ,VA,24501","SURGERY CENTER OF LYNCHBURG, 2401, ATHERHOLT ROAD, LYNCHBURG CITY, LYNCHBURG, VIRGINIA, 24501, UNITED STATES",37.4084287,-79.1778864362705
"901 PATIENTS FIRST DR                   ,WASHINGTON               ,MO,63090","901, PATIENTS FIRST DRIVE, DOWNTOWN WASHINGTON, WASHINGTON, FRANKLIN COUNTY, MISSOURI, 63090, UNITED STATES",38.5489355,-91.0025944
"281 LINCOLN ST                          ,WORCESTER                ,MA,01605","UMASS MEMORIAL MEDICAL CENTER - HAHNEMANN CAMPUS, 281, LINCOLN STREET, WASHBURN AND MOEN NORTH WORKS HISTORIC DISTRICT, WORCESTER, WORCESTER COUNTY, MASSACHUSETTS, 01605, UNITED STATES OF AMERICA",42.285242,-71.78967731415291
"150 W WASHINGTON ST                     ,SHELBYVILLE              ,IN,46176","150, WEST WASHINGTON STREET, SHELBYVILLE, SHELBY COUNTY, INDIANA, 46176, UNITED STATES OF AMERICA",39.524525,-85.7800846315789
"960 E WALNUT LAWN ST                    ,SPRINGFIELD              ,MO,65807","960, EAST WALNUT LAWN STREET, SPRINGFIELD, GREENE COUNTY, MISSOURI, 65807, UNITED STATES",37.152698,-93.281696
"3030 WATERVIEW PKWY                     ,RICHARDSON               ,TX,75080","3030, WATERVIEW PARKWAY, RICHARDSON, COLLIN COUNTY, TEXAS, 75080, UNITED STATES OF AMERICA",32.995045399999995,-96.7543485107593
"1900 CENTRACARE CIR                     ,SAINT CLOUD              ,MN,56303","1900, CENTRACARE CIRCLE, ST. CLOUD, STEARNS COUNTY, MINNESOTA, 56303, UNITED STATES",45.5825842,-94.2059288
"10820 PARKSIDE DR                       ,KNOXVILLE                ,TN,37934","PARKSIDE DRIVE, KNOXVILLE, KNOX COUNTY, TENNESSEE, 37934, UNITED STATES",35.9077223,-84.131817
"3470 E FRANK PHILLIPS BLVD              ,BARTLESVILLE             ,OK,74006","3470, EAST FRANK PHILLIPS BOULEVARD, BARTLESVILLE, WASHINGTON COUNTY, OKLAHOMA, 74006, UNITED STATES",36.750671545282295,-95.93411683251259
"694 HILL COUNTRY DR                     ,KERRVILLE                ,TX,78028","694, HILL COUNTRY DRIVE, KERRVILLE, KERR COUNTY, TEXAS, 78028, UNITED STATES",30.043553999999997,-99.15108199999999
"836 PRUDENTIAL DR                       ,JACKSONVILLE             ,FL,32207","836, PRUDENTIAL DRIVE, LAVILLA, JACKSONVILLE, DUVAL COUNTY, FLORIDA, 32207, UNITED STATES",30.316205,-81.66391899999999
"77 WARREN ST                            ,BRIGHTON                 ,MA,02135","US FAMILY HEALTH PLAN AT BRIGHTON MARINE, 77, WARREN STREET, ABERDEEN, BRIGHTON, BOSTON, SUFFOLK COUNTY, MASSACHUSETTS, 02135, UNITED STATES",42.3490549,-71.14267
"500 JOHN DEERE RD                       ,MOLINE                   ,IL,61265","TRINITY MEDICAL CENTER, 500, JOHN DEERE ROAD, MOLINE, ROCK ISLAND COUNTY, ILLINOIS, 61265, UNITED STATES",41.4684787,-90.53195931530041
"523 N STATE OF FRANKLIN RD              ,JOHNSON CITY             ,TN,37604","523, NORTH STATE OF FRANKLIN ROAD, JOHNSON CITY, WASHINGTON COUNTY, TENNESSEE, 37604, UNITED STATES",36.315130029446394,-82.3889036121862
"314 E 30TH ST                           ,NEW YORK                 ,NY,10016","314, EAST 30TH STREET, KIPS BAY, MANHATTAN COMMUNITY BOARD 6, MANHATTAN, NEW YORK COUNTY, NEW YORK, 10016, UNITED STATES OF AMERICA",40.7417749,-73.9769873
"1501 N OAKLAND AVE                      ,BOLIVAR                  ,MO,65613","1501, NORTH OAKLAND AVENUE, BOLIVAR, POLK COUNTY, MISSOURI, 65613, UNITED STATES",37.625975457312,-93.42081532231701
"1460 BLUEGRASS AVE                      ,LOUISVILLE               ,KY,40215","SAINT SIMON AND SAINT JUDE CHURCH, 1460, BLUEGRASS AVENUE, LOUISVILLE, JEFFERSON COUNTY, KENTUCKY, 40215, UNITED STATES",38.178959899999995,-85.78911105924729
"3535 S NATIONAL AVE                     ,SPRINGFIELD              ,MO,65807","3535, SOUTH NATIONAL AVENUE, SPRINGFIELD, GREENE COUNTY, MISSOURI, 65804, UNITED STATES",37.1497144738666,-93.27786326746451
"2330 EASTCHESTER RD                     ,BRONX                    ,NY,10469","EASTCHESTER CANCER CENTER, 2330, EASTCHESTER ROAD, BAYCHESTER, THE BRONX, BRONX COUNTY, NEW YORK, 10469, UNITED STATES OF AMERICA",40.860105700000005,-73.84267022390091
"1215 21ST AVE S                         ,NASHVILLE                ,TN,37232","1215, 21ST AVENUE SOUTH, NASHVILLE-DAVIDSON, DAVIDSON COUNTY, TENNESSEE, 37212, UNITED STATES OF AMERICA",36.1425438223815,-86.80015696185471
"3101 VALENCIA DR                        ,IDAHO FALLS              ,ID,83404","VALENCIA DR, IDAHO FALLS, BONNEVILLE COUNTY, IDAHO, 83404, UNITED STATES OF AMERICA",43.467512,-111.987799
"404 N KEENE ST                          ,COLUMBIA                 ,MO,65201","404, NORTH KEENE STREET, COLUMBIA, BOONE COUNTY, MISSOURI, 65201, UNITED STATES",38.9572493673469,-92.28950248979591
"500 LENNON LN                           ,WALNUT CREEK             ,CA,94598","500, LENNON LANE, SHADELANDS BUSINESS PARK, WALNUT CREEK, CONTRA COSTA COUNTY, CALIFORNIA, 95498, UNITED STATES",37.93042225,-122.031982425352
"1660 NW 7TH CT                          ,MIAMI                    ,FL,33136","HIGHLAND PARK PAVILION, 1660, NORTHWEST 7TH COURT, WYNWOOD, MIAMI, MIAMI-DADE COUNTY, FLORIDA, 33136, UNITED STATES",25.79094445,-80.2083944511076
"507 INDUSTRIAL BLVD                     ,DUBLIN                   ,GA,31021","507, INDUSTRIAL BOULEVARD, DUBLIN, LAURENS COUNTY, GEORGIA, 31021, UNITED STATES",32.5299924545455,-82.9451218181818
"1717 E MONUMENT ST                      ,BALTIMORE                ,MD,21287","1717, EAST MONUMENT STREET, WASHINGTON HILL, BALTIMORE, MARYLAND, 21205, UNITED STATES",39.2983111525001,-76.59381607106859
"301 W 6TH AVE                           ,DENVER                   ,CO,80204","DENVER HEALTH MEDICAL CENTER PAVILION G WELLINGTON E. WEBB, 301, WEST 6TH AVENUE, SHERMAN STREET HISTORIC DISTRICT, DENVER, DENVER COUNTY, COLORADO, 80204, UNITED STATES",39.72635615,-104.991667228647
"2421 SILVER STREAM LN                   ,WILMINGTON               ,NC,28401","2421, SILVER STREAM LANE, WILMINGTON, NEW HANOVER COUNTY, NORTH CAROLINA, 28401, UNITED STATES",34.1964946176471,-77.93238691176471
"1144 N 28TH ST                          ,BILLINGS                 ,MT,59101","1144, NORTH 28TH STREET, BILLINGS, YELLOWSTONE COUNTY, MONTANA, 59101, UNITED STATES",45.79308270426189,-108.51672100518199
"8931 COLONIAL CENTER DR                 ,FORT MYERS               ,FL,33905","8931, COLONIAL CENTER DRIVE, CORAL POINTE AT THE FORUM APARTMENTS, FORT MYERS, LEE COUNTY, FLORIDA, 33905, UNITED STATES",26.613985041897003,-81.807601530456
"250 CHERRY ST SE                        ,GRAND RAPIDS             ,MI,49503","LACKS CANCER CENTER, 250, CHERRY STREET SOUTHEAST, HERITAGE HILL HISTORIC DISTRICT, GRAND RAPIDS, KENT COUNTY, MICHIGAN, 49503, UNITED STATES OF AMERICA",42.95906725,-85.66204366456701
"550 B ST                                ,YUBA CITY                ,CA,95991","B STREET, YUBA CITY, SUTTER COUNTY, CALIFORNIA, UNITED STATES OF AMERICA",39.129997700000004,-121.63115220000002
"37 BALL PARK RD                         ,HARLAN                   ,KY,40831","BALL PARK ROAD, HARLAN COUNTY, KENTUCKY, 40855, UNITED STATES",36.953786,-82.885421
"2946 E BANNER GATEWAY DR                ,GILBERT                  ,AZ,85234","BANNER MD ANDERSON CANCER CENTER, 2946, BANNER GATEWAY DRIVE, MESA, MARICOPA COUNTY, ARIZONA, 85234, UNITED STATES OF AMERICA",33.38482705,-111.726343658494
"325 W 15TH ST                           ,NEW YORK                 ,NY,10011","325, WEST 15TH STREET, CHELSEA, MANHATTAN COMMUNITY BOARD 4, MANHATTAN, NEW YORK COUNTY, NEW YORK, 10011, UNITED STATES OF AMERICA",40.7411264,-74.00338559999999
"990 S MADISON ST                        ,TUPELO                   ,MS,38801","990, SOUTH MADISON STREET, TUPELO, LEE COUNTY, MISSISSIPPI, 38801, UNITED STATES",34.240513,-88.711759
"3912 TRINDLE RD                         ,CAMP HILL                ,PA,17011","TRINDLE ROAD, CAMP HILL, CUMBERLAND COUNTY, PENNSYLVANIA, 17011, UNITED STATES",40.2352871,-76.94362650000001
"364 BROOKLINE AVE                       ,BOSTON                   ,MA,02215","364, BROOKLINE AVENUE, AUDUBON SQUARE, FENWAY, BOSTON, SUFFOLK COUNTY, MASSACHUSETTS, 02215, UNITED STATES",42.33877408,-71.10731688
"720 CENTRE ST                           ,BROCKTON                 ,MA,02302","720, CENTRE STREET, BROCKTON, PLYMOUTH COUNTY, MASSACHUSETTS, 02302, UNITED STATES OF AMERICA",42.08666115,-70.9892970775821
"1637 CHEW ST                            ,ALLENTOWN                ,PA,18102","CHEW STREET, JORDAN HEIGHTS, ALLENTOWN, LEHIGH COUNTY, PENNSYLVANIA, 18104, UNITED STATES OF AMERICA",40.607479,-75.46990600000001
"975 W FARIS RD                          ,GREENVILLE               ,SC,29605","NEW HORIZON FAMILY HEALTH SERVICES, 975, WEST FARIS ROAD, GANTT, GREENVILLE COUNTY, SOUTH CAROLINA, 29605, UNITED STATES",34.81588970000001,-82.414302097928
"4266 SUNBEAM RD                         ,JACKSONVILLE             ,FL,32257","COMMUNITY HOSPICE AND PALLIATIVE CARE, 4266, SUNBEAM ROAD, BAYMEADOWS, JACKSONVILLE, DUVAL COUNTY, FLORIDA, 32257, UNITED STATES OF AMERICA",30.204453700000002,-81.6055537
"5400 KELL BLVD                          ,WICHITA FALLS            ,TX,76310","KELL BOULEVARD, WICHITA FALLS, WICHITA COUNTY, TEXAS, 76301, UNITED STATES",33.9043107,-98.48614920000001
"302 WESTWOOD AVE                        ,HIGH POINT               ,NC,27262","302, WESTWOOD AVENUE, HIGH POINT, GUILFORD COUNTY, NORTH CAROLINA, 27262, UNITED STATES OF AMERICA",35.961517609016205,-80.0118376965175
"1 MOBILE INFIRMARY CIR                  ,MOBILE                   ,AL,36607","1, MOBILE INFIRMARY CIRCLE, LYONS PARK, MOBILE, MOBILE COUNTY, ALABAMA, 36607, UNITED STATES",30.69478125,-88.0798530564626
"9500 S 1300 E                           ,SANDY                    ,UT,84094","1300 EAST, SEVEN OAKS, SANDY, SALT LAKE COUNTY, UTAH, 84094, UNITED STATES OF AMERICA",40.5638449,-111.8531263
"440 E MAIN ST                           ,BAY SHORE                ,NY,11706","440, MAIN STREET, BAY SHORE, SUFFOLK COUNTY, NEW YORK, 11706, UNITED STATES",40.726756979798004,-73.2337775151515
"1245 HIGHLAND AVE                       ,ABINGTON                 ,PA,19001","ABINGTON NEUROLOGICAL ASSOCIATES, 1245, HIGHLAND AVENUE, ABINGTON TOWNSHIP, MONTGOMERY COUNTY, PENNSYLVANIA, 19001, UNITED STATES",40.1196845,-75.1208574
"720 W FOREST AVE                        ,JACKSON                  ,TN,38301","WEST FOREST AVENUE, JACKSON, MADISON COUNTY, TENNESSEE, 38301, UNITED STATES OF AMERICA",35.6355808,-88.83300859999999
"2020 CENTRAL AVE                        ,DODGE CITY               ,KS,67801","DODGE CITY MEDICAL CENTER, 2020, CENTRAL AVENUE, DODGE CITY, FORD COUNTY, KANSAS, 67801, UNITED STATES",37.7687149,-100.01585759999999
"251 COUNTY ROAD 120                     ,SAINT CLOUD              ,MN,56303","COUNTY ROAD 120, ST. CLOUD, STEARNS COUNTY, MINNESOTA, 56303, UNITED STATES OF AMERICA",45.5861175,-94.20837359999999
"2108 CHARLOTTE AVE                      ,NASHVILLE                ,TN,37203","2108, CHARLOTTE AVENUE, EAST NASHVILLE, NASHVILLE-DAVIDSON, DAVIDSON COUNTY, TENNESSEE, 37209, UNITED STATES OF AMERICA",36.156535,-86.806611
"1450 8TH AVE                            ,FORT WORTH               ,TX,76104","1450, 8TH AVENUE, FAIRMOUNT, FORT WORTH, TARRANT COUNTY, TEXAS, 76104, UNITED STATES OF AMERICA",32.7303326969697,-97.3438182121212
"204 CLEVELAND ST                        ,GREAT BEND               ,KS,67530","204, CLEVELAND STREET, GREAT BEND, BARTON COUNTY, KANSAS, 67530, UNITED STATES",38.35473379084971,-98.7914969607843
"4500 13TH ST                            ,GULFPORT                 ,MS,39501","MEMORIAL HOSPITAL AT GULFPORT, 4500, 13TH STREET, GULFPORT, HARRISON COUNTY, MISSISSIPPI, 39501, UNITED STATES",30.36791715,-89.11547726344999
"550 UNIVERSITY BLVD                     ,INDIANAPOLIS             ,IN,46202","IU HEALTH UNIVERSITY HOSPITAL, 550, UNIVERSITY BOULEVARD, INDIANAPOLIS, MARION COUNTY, INDIANA, 46202, UNITED STATES",39.7759498,-86.17669389965349
"9000 STONY POINT PKWY                   ,RICHMOND                 ,VA,23235","9000, STONY POINT PARKWAY, STONY POINT FASHION PARK, FERNLEIGH, RICHMOND CITY, VIRGINIA, 23235, UNITED STATES",37.552753,-77.56615500000001
"3600 W BETHEL AVE                       ,MUNCIE                   ,IN,47304","WEST BETHEL AVENUE, MUNCIE, DELAWARE COUNTY, INDIANA, 47304, UNITED STATES",40.211364,-85.4114536
"300 E 66TH ST                           ,NEW YORK                 ,NY,10065","300, EAST 66TH STREET, LENOX HILL, MANHATTAN COMMUNITY BOARD 8, MANHATTAN, NEW YORK COUNTY, NEW YORK, 10065, UNITED STATES OF AMERICA",40.764855,-73.961058
"336 HOME BLVD                           ,GALESBURG                ,IL,61401","ILLINOIS CANCERCARE, 336, HOME BOULEVARD, GALESBURG, KNOX COUNTY, ILLINOIS, 61401, UNITED STATES",40.9742203,-90.3771713
"500 W 3RD ST                            ,ODESSA                   ,TX,79761","WEST 3RD STREET, SCHARBAUER PLACE, ODESSA, ECTOR COUNTY, TEXAS, 79763, UNITED STATES",31.841419300000002,-102.3782652
"3415 MCINTOSH CIR                       ,JOPLIN                   ,MO,64804","BRAD A. COSENS PHARMACY, 3415, MCINTOSH CIRCLE, JOPLIN, NEWTON COUNTY, MISSOURI, 64804, UNITED STATES",37.0506572,-94.5237533268286
"1123 PEARL ST                           ,BROCKTON                 ,MA,02301","1123, PEARL STREET, BROCKTON, PLYMOUTH COUNTY, MASSACHUSETTS, 02357, UNITED STATES OF AMERICA",42.0506769,-71.0683387626998
"14529 CORTEZ BLVD                       ,BROOKSVILLE              ,FL,34613","CORTEZ BOULEVARD, BROOKSVILLE, HERNANDO COUNTY, FLORIDA, 34603, UNITED STATES",28.5423038,-82.41088020000001
"1240 LEE ST                             ,CHARLOTTESVILLE          ,VA,22908","LEE STREET, STARR HILL, CHARLOTTESVILLE, VIRGINIA, 22908, UNITED STATES",38.0312133,-78.4957801
"1635 AURORA CT                          ,AURORA                   ,CO,80045","COURTYARD CAFE, 1635, AURORA COURT, AURORA, ADAMS COUNTY, COLORADO, 80045, UNITED STATES",39.742605700000006,-104.84017349999999
"150 PIERCE ST                           ,SOMERSET                 ,NJ,08873","150, PIERCE STREET, FRANKLIN TOWNSHIP, SOMERSET COUNTY, NEW JERSEY, 08873, UNITED STATES OF AMERICA",40.5360722626263,-74.5416190606061
"2001 STATE DR                           ,CORINTH                  ,MS,38834","STATE DRIVE, CORINTH, ALCORN COUNTY, MISSISSIPPI, 38834, UNITED STATES",34.9363488,-88.5605687
"2014 COLLEGE AVE                        ,BAKERSFIELD              ,CA,93305","2014, COLLEGE AVENUE, EAST BAKERSFIELD, KERN COUNTY, CALIFORNIA, 93305, UNITED STATES",35.3830884949495,-118.967639515152
"14101 FAIRVIEW DR                       ,BURNSVILLE               ,MN,55337","14101, FAIRVIEW DRIVE, BURNSVILLE, DAKOTA COUNTY, MINNESOTA, 55337, UNITED STATES",44.749002931880504,-93.27448750816221
"600 N UNION AVE                         ,NEW BRAUNFELS            ,TX,78130","CHRISTUS SANTA ROSA - NEW BRAUNFELS, 600, NORTH UNION AVENUE, NEW BRAUNFELS, COMAL COUNTY, TEXAS, 78130, UNITED STATES OF AMERICA",29.7159452,-98.1236225035927
"5330 N LOOP 1604 W                      ,SAN ANTONIO              ,TX,78249","CUMBERLAND SURGICAL HOSPITAL, 5330, NORTH LOOP 1604 WEST, SAN ANTONIO, BEXAR COUNTY, TEXAS, 78249, UNITED STATES",29.59076535,-98.59035775
"9000 N MAIN ST                          ,DAYTON                   ,OH,45415","NORTH MAIN STREET, DAYTON, MONTGOMERY COUNTY, OHIO, 45415, UNITED STATES OF AMERICA",39.8046905,-84.2216324
"901 N STRONG BLVD                       ,MCALESTER                ,OK,74501","901, STRONG BOULEVARD, MCALESTER, PITTSBURG COUNTY, OKLAHOMA, 74501, UNITED STATES",34.935988,-95.748069
"801 SAINT MARYS DR                      ,EVANSVILLE               ,IN,47714","801, SAINT MARYS DRIVE, EVANSVILLE, VANDERBURGH COUNTY, INDIANA, 47714, UNITED STATES",37.9655924992395,-87.5037317191981
"801 E BAKER ST                          ,PLANT CITY               ,FL,33563","801, BAKER STREET, PLANT CITY, HILLSBOROUGH COUNTY, FLORIDA, 33563, UNITED STATES",28.018420959183697,-82.1182697040816
"5125 SKYWAY                             ,PARADISE                 ,CA,95969","SKYWAY, PARADISE, BUTTE COUNTY, CALIFORNIA, 95969, UNITED STATES OF AMERICA",39.744167,-121.65058
"7505 OSLER DR                           ,TOWSON                   ,MD,21204","7505, OSLER DRIVE, YORKLEIGH, TOWSON, BALTIMORE COUNTY, MARYLAND, 21204, UNITED STATES OF AMERICA",39.387714700000004,-76.6118108
"6801 ROGERS AVE                         ,FORT SMITH               ,AR,72903","6801, ROGERS AVENUE, FORT SMITH, SEBASTIAN COUNTY, ARKANSAS, 72903, UNITED STATES",35.355986,-94.358121
"1030 COMMERCE CREEK BLVD                ,CAPE CORAL               ,FL,33909","COMMERCE CREEK BOULEVARD, CASA DI FIORI, CAPE CORAL, LEE COUNTY, FLORIDA, 33909, UNITED STATES OF AMERICA",26.681216,-81.91962
"901 HYDE ST                             ,SAN FRANCISCO            ,CA,94109","901, HYDE STREET, NOB HILL, SAN FRANCISCO, SAN FRANCISCO CITY AND COUNTY, CALIFORNIA, 94109, UNITED STATES OF AMERICA",37.789219,-122.417144
